coderome,a_pourvoir_le,titre_offre,date_publication,des_que_possible_desc,diplome,duree_contrat,nb_postes,numero,created,niveau_formation,experience,commune_emploi,employeur_nom_entreprise,employeur_adresse_correspondance_subdivision,activites_multivalue,competences_multivalue,contact_mail
J1202,2026-01-05,Pharmacien / Pharmacienne,2026-01-05 08:32:48+00,Dès que possible,DOCTEUR EN PHARMACIE,1 mois,1,2026-01-023900,2026-01-05 08:32:48+00,"Bac + 3, bac + 4",Au moins 5 ans,Nouméa,PHARMACIE MUTUALISTE DU PONT DES FRANCAIS,98874,"Délivrer une prescription médicale,Réaliser des opérations liées à la gestion des ressources humaines,Vendre ou louer des produits ou des services,Établir, mettre à jour un dossier, une base de données,Conseiller, accompagner une personne,Informer sur les modalités de la prescription,Réaliser des préparations pharmaceutiques,Évaluer, prévenir, et gérer les risques et la sécurité,Réaliser le suivi de délivrance des médicaments dans l'ordonnancier,Contrôler l'état des stocks,Contrôler la modalité de délivrance de certains médicaments spécifiques (stupéfiants, ¿),Réaliser des opérations comptables,Concevoir et mettre en oeuvre des actions de sensibilisation,Définir des besoins en approvisionnement,Assurer la gestion administrative d'une activité,Apporter un appui technique pour le personnel,Organiser et contrôler un approvisionnement,Enseigner, transmettre des connaissances, développer des compétences,Contrôler la conformité des données ou des documents,Identifier la demande du service de soins ou du patient,Contribuer à la mise en oeuvre d'essais cliniques,Réceptionner des produits, des matières premières, vérifier la conformité d'une livraison",,m.ozoux@pharmut.nc
J1103,2026-01-08,Chirurgien-dentiste / Chirurgienne-dentiste,2026-01-08 14:49:21+00,Dès que possible,Diplôme d'Etat de Docteur en chirurgie dentaire (https://www.mdf.nc/),,3,2026-01-023957,2026-01-08 14:49:21+00,Bac + 5 et plus,Aucune expérience professionnelle,Nouméa,MDF,98851 Nouméa Cédex,"Conseiller le patient sur l'hygiène bucco-dentaire ou mettre en place des actions de prévention et de dépistage,Déterminer l'appareillage selon les contraintes et les attentes du patient,Renseigner des documents médico-administratifs,Identifier la demande (visite de contrôle, soins dentaires, actes d'orthodontie, ...) et recueillir les informations (antécédents, traitements en cours, ...) auprès du patient ou dans le dossier de soins,Sélectionner le matériel, les produits et réaliser les soins,Procéder à l'examen de la cavité buccale et informer le patient sur le traitement",Règles d'hygiène et d'asepsie,recrutement@mdf.nc
J1102,2021-09-06,Médecin généraliste,2026-01-08 14:50:37+00,Dès que possible,Diplôme d'Etat de Docteur en médecine,,2,2026-01-023958,2026-01-08 14:50:37+00,Bac + 5 et plus,Moins d'1 an,Dumbéa,MDF,98851 Nouméa Cédex,,,recrutement@mdf.nc
F1608,2026-01-07,Aide carreleur / carreleuse,2026-01-07 17:11:15+00,Dès que possible,,2 mois,1,2026-01-023941,2026-01-07 16:44:55+00,,Au moins 1 an,Nouméa,Anonyme,,"Poser des carreaux sur un support,Poser des carrelages, faïences, plinthes au mur en méthode collée,Poser des carrelages au sol en méthode scellée ou collée,Poser des carrelages en piscines, ou dans des locaux à sollicitation mécanique forte (industries, surfaces commerciales),Poser des carrelages et des plinthes sur un escalier en méthode scellée ou collée","Techniques de pose verticale de revêtement,Techniques de coupe des revêtements,Techniques de pose horizontale de revêtement,Techniques de pose de carreaux",rhguima@outlook.fr
J1506,2026-01-05,Infirmier préleveur / Infirmière préleveuse,2026-01-05 12:06:39+00,Dès que possible,Diplôme d'Etat Infirmier,5 mois,1,2026-01-023907,2026-01-05 12:06:39+00,"Bac + 3, bac + 4",Au moins 3 ans,Dumbéa,CALEDOBIO,98845 NOUMEA CEDEX,"Pratiquer des prélèvements sanguins et bactériologiques,Renseigner des documents médico-administratifs,Désinfecter et décontaminer un équipement,Cerner l'état du patient (clinique, psychologique) et consigner les informations recueillies dans le dossier médical,Tenir à jour les dossiers médico-administratifs des patients","Hygiène hospitalière,Démarche de Soins Infirmiers (DSI),Charte des droits du patient",recrutement@caledobio.nc
K1201,2026-01-21,Assistant / Assistante de service social,2025-12-31 10:55:07+00,"",DEES OU DEAS,2 mois,1,2025-12-023881,2025-12-31 10:55:07+00,"Bac + 3, bac + 4",Au moins 3 ans,Mont-Dore (Le),ADAVI-988,98848 NOUMEA CEDEX,"Analyser une situation et produire un diagnostic,Établir, mettre à jour un dossier, une base de données,Développer un réseau d'intervenants médicosociaux,Créer une relation de confiance,Sensibiliser un public,Gérer une situation conflictuelle,Rédiger un rapport, un compte rendu d'activité,Analyser la situation et les besoins de la personne,Orienter une personne vers des partenaires relais,Développer et gérer des relations interpersonnelles,Analyser, exploiter, structurer des données,Acceuillir, orienter, informer une personne","Caractéristiques socio-culturelles des publics,Droit social,Techniques de communication orales, écrites et numériques,Normes rédactionnelles",direction@adavi.nc
G1602,2025-11-14,Chef de partie,2025-11-14 13:21:25+00,Dès que possible,,3 mois,1,2025-11-023529,2025-11-14 13:21:25+00,,Au moins 3 ans,Nouméa,MV LOUNGE,98800 Nouméa,,,recrutement@medusabeachclub.net
M1608,2026-02-01,Secrétaire comptable,2025-12-29 14:15:32+00,"",,,1,2025-12-023838,2025-12-22 14:26:37+00,"Bac, bac professionnel",Au moins 3 ans,Dumbéa,Anonyme,,"Établir, mettre à jour un dossier, une base de données,Utiliser les outils bureautiques,Réaliser une veille documentaire,Structurer, synthétiser des informations,Rédiger un rapport, un compte rendu d'activité,Collecter les éléments d'activité du personnel,Assurer un accueil téléphonique,Classer des documents","Méthode de classement et d'archivage,Gestion administrative du courrier,Modalités d'accueil",direction.lbdp@hcm.nc
M1601,2026-01-15,Chargé / Chargée d'accueil,2026-01-15 09:37:08+00,Dès que possible,,,1,2026-01-024017,2026-01-15 09:37:08+00,"Bac, bac professionnel",Moins d'1 an,Nouméa,ESSOR,98807 Nouméa Cédex,"Faciliter la résolution de questions et démarches administratives,Utiliser les outils bureautiques,Corriger et mettre en forme un document,Transmettre de l'information,Prévenir et résoudre les conflits","Modalités d'accueil,Techniques de communication orales, écrites et numériques,Système d'information et de communication",contact@acti-immo.nc
K1204,2026-02-02,Médiateur social et culturel / Médiatrice sociale et culturelle,2026-01-10 11:22:25+00,"",,1 an(s),1,2026-01-023968,2026-01-10 11:22:25+00,Bac +2,Au moins 1 an,Nouméa,Association Symbiose,98800 NOUMEA,"Concevoir et gérer un projet,Faciliter la résolution de questions et démarches administratives,Sensibiliser un public,Utiliser les réseaux sociaux,Rédiger un rapport, un compte rendu d'activité,Concevoir des animations selon les types de publics,Animer, coordonner une équipe,Animer un réseau, une communauté,Acceuillir, orienter, informer une personne",,vcornuet.symbiose@gmail.com
K1301,2025-12-26,Accompagnateur médicosocial / Accompagnatrice médicosociale d'activités de la vie journalière,2025-12-26 17:07:24+00,Dès que possible,,,1,2025-12-023862,2025-12-26 17:07:24+00,Certification locale,Au moins 5 ans,Nouméa,Association de Coopération Sociale et Médico-Sociale,98845 Nouméa Cédex,"Accompagner une personne dans les gestes de la vie quotidienne,Prodiguer des soins paramédicaux,Contribuer au bien-être physique d'une personne,Manipuler un équipement médicalisé,Analyser la situation et les besoins de la personne,Renseigner des documents médico-administratifs,Conseiller la personne sur des aides techniques (aides visuelles, déambulateur) ou installer le matériel (pose de barrière de protection, réglage de hauteur de table),Prodiguer des soins médicaux,Présenter à la personne les activités d'aide ou d'éveil et définir les modalités de mise en oeuvre et d'accompagnement",,factures@acsms.nc
C1201,2026-01-08,Conseiller / Conseillère accueil en agence bancaire,2026-01-08 08:32:03+00,Dès que possible,"NDRC, MCO, Commerce, Banque",3 mois,2,2026-01-023948,2026-01-08 08:32:03+00,Bac +2,Au moins 1 an,Nouméa,SGCB,98848 NOUMEA CEDEX,"Réceptionner, vérifier ou enregistrer les paquets, colis, lettres en recommandé, bordereaux d'acheminement postal,Gérer des réclamations et litiges,Développer et fidéliser la relation client,Vendre ou louer des produits ou des services,Conseiller, accompagner une personne,Élaborer, adapter une proposition commerciale,Générer des ventes en appliquant les méthodes et techniques commerciales,Sensibiliser les clients à l'utilisation des automates et des services à distance,Actualiser les informations mises à la disposition d'un public,Gérer des situations d'urgence,Définir des besoins en approvisionnement,Classer des documents,Identifier, traiter une demande client,Présenter et valoriser un produit ou un service,Négocier un taux d'achat ou de vente de devises étrangères,Acceuillir, orienter, informer une personne,Respecter la confidentialité des informations","Réglementation bancaire,Règles et consignes de sécurité,Typologie des devises,Caractéristiques des produits financiers,Techniques de vente,Procédures d'encaissement,Normes rédactionnelles,Modes de paiement",recrutements@sgcb.nc
G1603,2026-01-06,Employé / Employée de snack-bar,2026-01-06 09:11:48+00,Dès que possible,,3 mois,1,2026-01-023918,2026-01-06 09:11:48+00,Aucune formation scolaire,Aucune expérience professionnelle,Nouméa,Anonyme,,"Réaliser la plonge,Conditionner des produits,Remettre la commande au client (service à l'assiette, emballage à emporter, plateau, ...),Préparer et/ou réchauffer des pains et des viennoiseries,Respecter des règles, des consignes, normes et procédures opérationnelles,Procéder à l'encaissement,Respecter les règles de Qualité, Hygiène, Sécurité, Santé et Environnement (QHSSE),Préparer des boissons chaudes ou froides,Préparer des plats cuisinés,Disposer des produits sur le lieu de vente,Entretenir, nettoyer un espace, un lieu, un local,Cuire des viandes, poissons ou légumes,Planifier une production selon les flux de vente prévisionnels,Préparer, assembler des plats simples,Répondre aux attentes d'un client,Relever, contrôler, ajuster des mesures et dosages,Acceuillir, orienter, informer une personne,Réceptionner des produits, des matières premières, vérifier la conformité d'une livraison",,motoropool@indikitch.nc
D1212,2026-01-06,Vendeur / Vendeuse en informatique,2026-01-06 10:37:23+00,Dès que possible,,3 mois,1,2026-01-023920,2026-01-06 10:37:23+00,"Bac, bac professionnel",Au moins 1 an,Nouméa,MOBILE MANIA,98800 Nouméa,"Informer, renseigner une personne sur les articles en vente,Développer et fidéliser la relation client,Utiliser les outils bureautiques,Procéder à l'encaissement,Réaliser la mise en rayon,Présenter et valoriser un produit ou un service,Acceuillir, orienter, informer une personne","Argumentation commerciale,Produits de téléphonie",drh@mobilecity.nc
L1401,2025-12-29,Jockey,2025-12-29 15:34:24+00,Dès que possible,,8 mois,1,2025-12-023868,2025-12-29 15:34:24+00,Aucune formation scolaire,Au moins 5 ans,Boulouparis,,98800,,,steven.agriperformance@gmail.com
G1501,2025-12-26,Employé / Employée de ménage d'hôtel,2025-12-26 09:35:53+00,Dès que possible,,1 mois,1,2025-12-023855,2025-12-26 09:35:53+00,,Au moins 1 an,Farino,LES BULLES DE FARINO,98881 FARINO,"Identifier et signaler les dysfonctionnements, les dégradations du mobilier et des équipements de la chambre,Réaliser le service des petits-déjeuners en salle, en chambre,Communiquer à l'oral en milieu professionnel,Respecter des règles, des consignes, normes et procédures opérationnelles,Approvisionner un chariot de ménage/chariot de linge,Désinfecter et décontaminer un équipement,Contrôler l'état du linge propre,Définir des besoins en approvisionnement,Entretenir, nettoyer un espace, un lieu, un local,Organiser et contrôler un approvisionnement,Changer les draps, refaire le lit (mise à blanc, recouche) et remplacer le linge de toilette",,colinleif@gmail.com
G1801,2025-11-14,Barman / Barmaid,2025-11-14 13:21:47+00,Dès que possible,,3 mois,1,2025-11-023530,2025-11-14 13:21:47+00,,Au moins 1 an,Nouméa,MV LOUNGE,98800 Nouméa,"Communiquer à l'oral en milieu professionnel,Préparer des boissons chaudes ou froides,Réaliser un service au bar,Changer un fût,Gérer une caisse,Respecter les règles de Qualité, Hygiène, Sécurité, Santé et Environnement (QHSSE),Gérer une situation conflictuelle,Entretenir, nettoyer un espace, un lieu, un local,Communiquer avec l'équipe de salle,Réaliser la mise en place de la salle et de l'office,Prendre une commande client",,recrutement@medusabeachclub.net
M1607,2026-01-09,Secrétaire,2026-01-09 11:13:52+00,Dès que possible,,,1,2026-01-023962,2026-01-09 11:13:52+00,"Bac, bac professionnel",Au moins 3 ans,Dumbéa,CHAMBRE DE METIERS ET DE L'ARTISANAT,98846 NOUMEA CEDEX,"Renseigner, mettre à jour une documentation technique,Établir, mettre à jour un dossier, une base de données,Assurer la gestion administrative d'une activité,Organiser des déplacements professionnels,Organiser la logistique des recrutements et des formations,Classer des documents,Planifier des rendez-vous,Acceuillir, orienter, informer une personne,Archiver des dossiers et documents de référence",Modalités d'accueil,rh@cma.nc
D1212,2026-01-07,Vendeur / Vendeuse en produits multimédia,2026-01-07 14:27:37+00,Dès que possible,,,1,2026-01-023936,2026-01-07 14:27:37+00,"Bac, bac professionnel",Moins d'1 an,Nouméa,Anonyme,,"Informer, renseigner une personne sur les articles en vente,Réaliser l'étiquetage de produits,Vendre ou louer des produits ou des services,Établir un contrat de vente,Gérer une caisse,Procéder à l'encaissement,Réaliser la mise en rayon,Présenter et valoriser un produit ou un service,Acceuillir, orienter, informer une personne,Réceptionner des produits, des matières premières, vérifier la conformité d'une livraison",,recrutement.multimedia.nc@gmail.com
J1303,2026-04-01,Technicien / Technicienne d'intervention sur matériels d'assistance respiratoire,2026-01-02 14:07:41+00,"",BT,9 mois,1,2026-01-023893,2026-01-02 14:07:41+00,Bac +2,Au moins 3 ans,Dumbéa,PACIFIC CARE,98895 NOUMEA CEDEX,"Accueillir et renseigner le patient sur les horaires de réception, les possibilités de rendez-vous, le déroulement de l'examen,Réceptionner les éléments médico-techniques et en informer le praticien, le patient en vue de l'intervention,Réaliser la décontamination, l'identification, le conditionnement d'éléments médico-techniques (empreintes, éléments prothétiques, ...) et les transmettre au service concerné,Tenir informé le praticien des activités,Définir des besoins en approvisionnement,Tenir à jour les dossiers médico-administratifs des patients,Planifier des rendez-vous médicaux selon le type d'intervention et le degré d'urgence,Suivre l'état des stocks,Accueillir des patients,Vérifier le fonctionnement des appareils et informer le service maintenance, le responsable en cas de dysfonctionnement,Établir une commande","Techniques de bio-nettoyage,Grille de codification Sécurité Sociale,Terminologie médicale,Procédures de retraitement des déchets,Gestion administrative,Règles d'hygiène et d'asepsie",rh@pacific-care.nc
G1602,2026-01-02,Chef de partie,2026-01-02 15:15:02+00,Dès que possible,Restauration,3 mois,1,2026-01-023894,2026-01-02 15:15:02+00,"CAP, BEP",Au moins 1 an,Nouméa,CAFE STORE VILLAGE,98800 Nouméa,"Conditionner des produits,Mettre en oeuvre les processus et les modes opératoires techniques,Respecter les règles de Qualité, Hygiène, Sécurité, Santé et Environnement (QHSSE),Cuisiner des sauces,Contrôler l'état des stocks,Concevoir des recettes et menus,Préparer des ustensiles de cuisine,Préparer des plats cuisinés,Définir des besoins en approvisionnement,Entretenir, nettoyer un espace, un lieu, un local,Cuire des viandes, poissons ou légumes,Entretenir un équipement, une machine, une installation,Éplucher des légumes et des fruits,Lutter contre le gaspillage alimentaire,Évacuer, recycler des déchets, des produits,Relever, contrôler, ajuster des mesures et dosages,Aménager un poste et les conditions de travail,Dresser des plats pour le service,Manipuler des équipements de cuisine,Préparer les viandes et les poissons,Réceptionner des produits, des matières premières, vérifier la conformité d'une livraison","Cuisine du monde,Législation alimentaire,Procédures de nettoyage et de désinfection,Fiches techniques de cuisine,Types de viande,Procédures de la marche en avant,Types de desserts,Règles et consignes de sécurité,Chaîne du froid,Système Hazard Analysis Critical Control Point (HACCP),Production culinaire,Familles de produits alimentaires,Types de produits traiteurs,Utilisation de plaques de cuisson,Utilisation d'outils tranchants (couteaux, hachoirs, ...),Variétés de fruits et légumes,Utilisation de four (à chaleur tournante, à air pulsé, ...),Gestes et postures de manutention,Règles d'hygiène et de sécurité alimentaire",cv@cafestore.nc
I1605,2026-01-05,Mécanicien / Mécanicienne de marine,2026-01-08 07:35:27+00,Dès que possible,,,1,2026-01-023946,2026-01-08 07:35:27+00,Bac +2,Au moins 3 ans,Nouméa,Anonyme,,"Démonter un équipement, une installation,Réaliser les raccordements hydrauliques, électriques, mécaniques des équipements et des accessoires,Contrôler la conformité d'un équipement, d'une machine, d'une installation,Déterminer une intervention de maintenance, de dépannage ou d'installation,Réaliser une opération de maintenance,Changer ou réparer une pièce ou un ensemble défectueux,Contrôler les systèmes de sécurité,Manipuler un engin de manutention ou de chantier,Réaliser une intervention nécessitant une habilitation,Entretenir l'équipement nautique",,madeleine.nguyen@smpa.nc
F1202,2025-12-08,Chef de chantier,2025-12-08 09:36:02+00,Dès que possible,,,1,2025-12-023728,2025-12-08 09:36:02+00,"CAP, BEP",Au moins 1 an,Nouméa,LINC,98800 Nouméa,"Anticiper des dangers, problèmes ou besoins matériels et techniques,Déléguer, responsabiliser,Préparer l'exécution du chantier,Gérer la relation avec les fournisseurs, sous-traitants, prestataires,Organiser le travail d'une équipe,Identifier et sélectionner des fournisseurs, sous-traitants, prestataires,Réceptionner un ouvrage,Apporter un appui technique aux équipes de chantier,Établir l'état d'avancement de travaux,Optimiser des modes opératoires,Identifier des moyens techniques et matériels pour un chantier,Coordonner le repli de tous les équipements et dispositifs du chantier,Contrôler une habilitation spécifique,Définir des besoins en approvisionnement,Organiser et contrôler un approvisionnement,Animer, coordonner une équipe,Répondre aux attentes d'un client,Acceuillir, orienter, informer une personne,Élaborer, suivre et piloter un budget,Concevoir et gérer un projet,Contrôler des indicateurs de performance, analyser et corriger des écarts,Utiliser les outils bureautiques,Expliquer et faire respecter les règles et procédures,Évaluer, prévenir, et gérer les risques et la sécurité,Respecter les règles de Qualité, Hygiène, Sécurité, Santé et Environnement (QHSSE),Rédiger un rapport, un compte rendu d'activité,Identifier, repérer un lieu,Veiller à maintenir un climat social favorable,Évacuer, recycler des déchets, des produits","Modalités de sécurisation d'un chantier,Chiffrage/calcul de coût",rh@linc.nc
J1506,2026-01-12,Infirmier / Infirmière en hémodialyse,2026-01-12 13:54:47+00,Dès que possible,IDE,,1,2026-01-023976,2026-01-12 13:54:47+00,"Bac + 3, bac + 4",Au moins 3 ans,Dumbéa,ATIR NC,98851 NOUMEA CEDEX,"Informer un patient,Pratiquer un suivi des pathologies chroniques stabilisées,Réaliser des soins d'hygiène corporelle, de confort et de prévention,Réaliser un prélèvement biologique,Pratiquer une prise en charge de la maladie rénale chronique,Désinfecter et décontaminer un équipement,Assurer la gestion administrative d'une activité,Renseigner des documents médico-administratifs,Pratiquer une hémodialyse,Surveiller l'état de santé d'une personne,Préparer, installer un dispositif médico-technique,Réaliser des soins infirmiers","Méthodes de décontamination de matériel,Techniques d'hémodialyse,Charte des droits du patient,Démarche de Soins Infirmiers (DSI),Hygiène hospitalière,Protocoles de soins d'urgence,Règles d'hygiène et d'asepsie",mprovost@atir.asso.nc
J1505,2026-01-12,Infirmier / Infirmière de santé au travail,2026-01-12 13:55:48+00,Dès que possible,Diplôme d'état d'infirmier,11 mois,1,2026-01-023977,2026-01-12 13:55:48+00,"Bac + 3, bac + 4",Au moins 1 an,Nouméa,CAFAT,98849 NEA CEDEX,"Détecter des situations à risques (maltraitance, harcèlement, urgence sociale, addiction...),Conseiller, accompagner une personne,Identifier les aménagements nécessaires d'un poste de travail,Rédiger un rapport, un compte rendu d'activité,Concevoir et mettre en place les actions de prévention, d'information sur la santé et les risques psychosociaux,Planifier des rendez-vous selon le type d'intervention et le degré d'urgence,Accueillir, orienter et renseigner un patient,Mettre en oeuvre des actions de communication interne","Ergonomie,Médecine du travail,Utilisation de sonomètre, dosimètre, ...",recrutement@cafat.nc
J1303,2026-01-19,Assistant / Assistante dentaire,2026-01-12 16:36:46+00,"",,1 mois,1,2026-01-023983,2026-01-12 16:36:46+00,Bac +2,Au moins 5 ans,Mont-Dore (Le),Anonyme,,"Recueillir les données d'un dispositif médico-technique,Réceptionner les éléments médico-techniques et en informer le praticien, le patient en vue de l'intervention,Désinfecter et décontaminer un équipement,Renseigner des documents médico-administratifs,Contrôler l'état des stocks,Réaliser des opérations comptables,Établir des éléments d'une commande,Préparer le matériel, les produits selon les indications du praticien et la nature de l'intervention,Assister le praticien dentaire (présentation des instruments) pendant l'intervention,Contrôler la conformité d'un équipement, d'une machine, d'une installation,Définir des besoins en approvisionnement,Assurer la gestion administrative d'une activité,Planifier des rendez-vous selon le type d'intervention et le degré d'urgence,Accueillir, orienter et renseigner un patient,Transmettre de l'information,Préparer, installer un dispositif médico-technique","Techniques de soins dentaires,Hygiène bucco-dentaire,Procédures de stérilisation du matériel,Procédures de bio nettoyage,Terminologie médicale,Dosimétrie,Règles d'hygiène et d'asepsie",murielleemilia@hotmail.com
C1504,2025-12-26,Agent / Agente immobilier,2025-12-26 11:03:50+00,Dès que possible,,,1,2025-12-023856,2025-12-26 11:03:50+00,Bac +2,Au moins 1 an,Nouméa,Anonyme,,"Utiliser les outils bureautiques,Conclure une transaction,Prospecter des biens immobiliers, des terrains,Réaliser le descriptif d'un bien immobilier,Évaluer la capacité financière d'un client,Négocier un mandat de vente ou de location,Valoriser un bien immobilier,Contribuer à des actions de promotion dans les médias et sur les réseaux sociaux,Organiser et planifier la visite de biens immobiliers,Prospecter de nouveaux clients, de nouveaux marchés,Estimer la valeur d'un bien, d'un produit,Concevoir des actions commerciales et promotionnelles,Présenter et valoriser un produit ou un service,Réaliser une veille de marché, une veille concurrentielle","Fiscalité,Vente immobilière,Évolution du marché immobilier,Techniques commerciales,Méthodes de transaction immobilière",recrutement2026nc@gmail.com
