coderome,a_pourvoir_le,titre_offre,date_publication,des_que_possible_desc,diplome,duree_contrat,nb_postes,numero,created,niveau_formation,experience,commune_emploi,employeur_nom_entreprise,employeur_adresse_correspondance_subdivision,activites_multivalue,competences_multivalue,contact_mail
J1303,2025-05-26,Technicien / Technicienne d'intervention sur matériels d'assistance respiratoire,2025-05-26 16:05:00+00,Dès que possible,,3 mois,1,2025-05-021974,2025-05-26 16:05:00+00,Bac +2,Moins d'1 an,Mont-Dore (Le),ISIS CALEDONIE,98857 NOUMEA CEDEX,"Conseiller, accompagner une personne,Recueillir les données d'un dispositif médico-technique,Contrôler la conformité d'un équipement, d'une machine, d'une installation,Désinfecter et décontaminer un équipement,Définir des besoins en approvisionnement,Installer à domicile du matériel médical (lit médicalisé, appareil d'assistance respiratoire, ...) et en expliquer le fonctionnement,Renseigner des documents médico-administratifs,Contrôler l'état des stocks,Transmettre de l'information,Préparer, installer un dispositif médico-technique",,xavier.rouquette@isis.nc
M1602,2025-08-01,Agent administratif / Agente administrative,2025-06-04 10:12:15+00,"",,3 an(s),3,2025-06-022052,2025-06-04 09:58:42+00,"CAP, BEP",Au moins 1 an,Nouméa,PALAIS DE JUSTICE,NOUMEA CEDEX,"Établir, mettre à jour un dossier, une base de données,Utiliser les outils bureautiques,Contrôler l'état des stocks,Procéder à l'enregistrement, au tri, à l'affranchissement du courrier",Méthode de classement et d'archivage,recrutement.tpi-noumea@justice.fr
J1506,2025-06-04,Infirmier / Infirmière en gériatrie,2025-06-04 10:14:10+00,Dès que possible,Diplôme d'etat infirmier,,1,2025-06-022049,2025-06-04 08:59:35+00,"Bac + 3, bac + 4",Au moins 1 an,Nouméa,Anonyme,,"Pratiquer un suivi des pathologies chroniques stabilisées,Réaliser un prélèvement biologique,Animer, coordonner une équipe,Surveiller l'état de santé d'une personne,Analyser des résultats d'examen médicaux,Réaliser des soins infirmiers",,Idec.tina@acbv.asso.nc
I1304,2025-05-27,Agent / Agente de maintenance industrielle,2025-05-27 13:23:09+00,Dès que possible,,1 mois,1,2025-05-021982,2025-05-27 13:23:09+00,"CAP, BEP",Au moins 1 an,Nouméa,Anonyme,,"Réaliser un diagnostic de fonctionnement et contrôler les machines, installations et équipements,Comprendre, interpréter des données et documents techniques,Monter et régler une installation, une machine,Respecter des règles, des consignes, normes et procédures opérationnelles,Participer à un travail collaboratif,Analyser des données de maintenance,Lire et exploiter un plan, un schéma,Détecter l'origine d'une panne (sur place ou à distance),Contrôler, surveiller et entretenir régulièrement les équipements,Collecter et analyser des informations,Analyser, exploiter, structurer des données","Utilisation d'appareils de mesure électrique (multimètre, ...),Mécanique",comptabilite@mienvironnement.nc
K1403,2025-07-01,Responsable d'établissement de santé,2025-05-27 10:50:05+00,"",candidater ici : https://www.mdf.nc/la-mdf-recrute,,1,2025-05-021981,2025-05-27 10:50:05+00,"Bac + 3, bac + 4",Au moins 5 ans,Nouméa,MDF,98851 Nouméa Cédex,,,recrutement@mdf.nc
D1209,2025-06-03,Vendeur / Vendeuse conseil en jardinerie,2025-06-03 10:32:10+00,Dès que possible,,6 mois,1,2025-06-022040,2025-06-03 10:32:10+00,"Bac, bac professionnel",Au moins 1 an,Nouméa,Anonyme,,"Appliquer un traitement, un produit,Développer et fidéliser la relation client,Procéder à l'encaissement,Contrôler l'état des stocks,Vendre ou utiliser des produits phytosanitaires,Proposer un traitement adapté,Identifier une maladie, un parasite ou une carence sur un végétal, un arbre,Contrôler l'état de conservation d'un produit périssable,Livrer une commande,Gérer une caisse,Définir des besoins en approvisionnement,Assurer la gestion administrative d'une activité,Identifier, traiter une demande client,Présenter et valoriser un produit ou un service,Organiser, aménager un espace de vente,Acceuillir, orienter, informer une personne,Transmettre une technique, un savoir-faire,Réceptionner des produits, des matières premières, vérifier la conformité d'une livraison",,compta@australimport.nc
K1201,2025-05-27,Assistant social / Assistante sociale,2025-05-27 15:29:34+00,Dès que possible,Diplôme d’assistant de service social,10 jours,1,2025-05-021986,2025-05-27 15:29:34+00,"Bac + 3, bac + 4",Au moins 1 an,Dumbéa,SAS CALEDONIE SANTE - CSSR,98835 DUMBEA,"Élaborer, suivre et piloter un budget,Concevoir et gérer un projet,Analyser une situation et produire un diagnostic,Établir, mettre à jour un dossier, une base de données,Appliquer un cadre juridique ou réglementaire,Mener une enquête sociale,Préparer et animer une réunion, un groupe de travail, un atelier,Rédiger un rapport, un compte rendu d'activité,Suivre des demandes de logements locatifs,Développer un réseau d'intervenants médicosociaux,Mener des actions de suivi social spécifiques à une structure et à un public,Créer une relation de confiance,Assurer la gestion administrative d'une activité,Analyser la situation et les besoins de la personne,Orienter une personne vers des partenaires relais,Transmettre de l'information,Développer et piloter un réseau d'organisations partenaires,Développer et gérer des relations interpersonnelles,Analyser, exploiter, structurer des données,Acceuillir, orienter, informer une personne","Économie sociale,Techniques de communication orales, écrites et numériques,Projet social",rh@cssr.nc
D1403,2025-04-22,Conseiller commercial / Conseillère commerciale auprès des particuliers,2025-04-22 11:29:15+00,Dès que possible,,3 mois,2,2025-04-021666,2025-04-22 11:29:15+00,"Bac, bac professionnel",Au moins 1 an,Nouméa,SARL LCG,98835 Dumbéa,"Conduire un entretien de vente,Présenter des produits et services,Effectuer le suivi d'une relation client,Collaborer avec l'ensemble des intervenants à la réalisation d'un objectif commun,Identifier les besoins d'un client,Conseiller un client,Proposer des solutions correctives","Entretien de vente,Logiciel de gestion clients,Argumentation commerciale,Techniques de vente,Typologie du client,Techniques commerciales",jeremie@fitnesspark.nc
D1401,2025-06-02,Assistant / Assistante administration des ventes,2025-04-30 15:53:22+00,"","Commercial, Gestion ou Finance",,1,2025-04-021747,2025-04-30 15:53:22+00,Bac +2,Au moins 3 ans,Nouméa,ER TRAVAUX,98845 NOUMEA CEDEX,"Assurer un service après-vente,Établir, mettre à jour un dossier, une base de données,Établir un devis,Utiliser les outils bureautiques,Effectuer le suivi des commandes, la facturation,Assurer la gestion administrative d'une activité,Assurer un accueil téléphonique,Transmettre de l'information,Déterminer des mesures correctives,Acceuillir, orienter, informer une personne",,rh@ert.nc
G1605,2025-05-30,Agent / Agente de cuisine,2025-05-30 16:29:21+00,Dès que possible,,1 mois,1,2025-05-022021,2025-05-30 16:29:21+00,,Moins d'1 an,Nouméa,MV LOUNGE,98800 Nouméa,"Réaliser la plonge,Essuyer et ranger la vaisselle, la verrerie, les ustensiles de cuisine,Entretenir, nettoyer un espace, un lieu, un local,Réaliser l'entretien des verres et des couverts (à la vapeur, au vinaigre, ...) et le rangement de la vaisselle",,rhmvlounge@gmail.com
J1202,2025-06-09,Pharmacien / Pharmacienne,2025-06-05 10:01:57+00,Dès que possible,,3 mois,1,2025-06-022073,2025-06-05 10:01:57+00,Bac + 5 et plus,Au moins 1 an,Dumbéa,Pharmacie Du Kaducee,98835 Dumbéa,,,albain.guegan@gmail.com
D1401,2025-06-10,Assistant / Assistante achat,2025-06-10 10:41:51+00,Dès que possible,,7 mois,1,2025-06-022105,2025-06-10 09:58:51+00,Bac +2,Au moins 1 an,Nouméa,SIDAPS,98863 NOUMEA CEDEX,"Assurer un service après-vente,Vérifier les conditions de réalisation d'une commande,Établir, mettre à jour un dossier, une base de données,Utiliser les outils bureautiques,Effectuer le suivi des commandes, la facturation,Assurer la gestion administrative d'une activité,Assurer un accueil téléphonique,Réaliser une étude technique et commerciale","Logiciel de gestion clients,Réglementation du transport de marchandises,Approvisionnement en ligne / E achat,Réglementation des douanes,Logistique internationale,Anglais technique,Bon de livraison,Organisation de la chaîne logistique,Techniques d'import/export",recrutement.calenis@gbh.fr
C1502,2025-06-13,Agent / Agente d'état des lieux,2025-06-13 10:59:46+00,Dès que possible,,,1,2025-06-022136,2025-06-13 10:59:46+00,Bac +2,Au moins 1 an,Nouméa,ESSOR,98807 Nouméa Cédex,"Planifier des travaux de rénovation,Évaluer et chiffrer des réparations,Gérer des réclamations et litiges,Réaliser un état des lieux,Assurer une médiation,Utiliser les outils bureautiques,Estimer les coûts et les délais d'une activité ou d'une prestation,Transmettre de l'information","Gestion juridique des précontentieux,Droit immobilier,Droits et obligations du locataire,Techniques de construction,Gestion immobilière en copropriété,Normes rédactionnelles",contact@acti-immo.nc
F1607,2025-05-12,Menuisier poseur / Menuisière poseuse aluminium,2025-05-12 07:59:29+00,Dès que possible,menuiserie,3 mois,1,2025-05-021832,2025-05-12 07:59:29+00,"CAP, BEP",Au moins 5 ans,Nouméa,ER TRAVAUX,98845 NOUMEA CEDEX,"Assurer un service après-vente,Respecter des règles, des consignes, normes et procédures opérationnelles,Organiser et planifier une activité,Respecter les règles de Qualité, Hygiène, Sécurité, Santé et Environnement (QHSSE),Démonter une fermeture menuisée et vérifier l'état du support,Installer une serrure et des accessoires de fermeture,Installer un équipement électronique,Réaliser un raccordement électrique de fermeture menuisée automatisée,Établir des éléments d'une commande,Poser un vitrage,Répondre aux attentes d'un client,Poser un blindage de porte ou de volet,Réaliser un diagnostic technique,Préparer du matériel en prévision d'un travail,Réaliser l'installation d'équipements motorisés et/ou connectés",,rh@ert.nc
E1106,2025-06-10,Journaliste de presse écrite,2025-06-10 14:39:15+00,Dès que possible,,1 mois,1,2025-06-022114,2025-06-10 14:39:15+00,"Bac + 3, bac + 4",Au moins 1 an,Nouméa,INTERMEDIAS,98857,"Identifier des sources et lieux d'information,Utiliser les outils bureautiques,Recueillir des informations lors d'enquêtes, reportages et interviews,Veiller au respect d'une ligne éditoriale,Rédiger un article de presse,Corriger et mettre en forme un document,Transmettre de l'information,Analyser, exploiter, structurer des données,Réaliser un reportage photographique ou filmé d'un évènement,Sélectionner des illustrations pour un article",,y.milin@voixducaillou.nc
K1104,2025-05-06,Psychologue clinicien / clinicienne,2025-05-06 11:51:06+00,Dès que possible,Master 2 en Psychologie,4 mois,1,2025-05-021787,2025-05-06 11:51:06+00,Bac + 5 et plus,Au moins 3 ans,Dumbéa,Anonyme,,"Concevoir et réaliser des soins de rééducation,Conseiller, accompagner une personne,Informer sur les possibilités d'interventions psychologiques,Animer une cellule de soutien psychologique,Préparer et animer une réunion, un groupe de travail, un atelier,Analyser la situation et les besoins de la personne,Réaliser un accompagnement psychologique,Déterminer le besoin en accompagnement psychologique, arrêter les modalités avec la personne ou l'orienter vers un médecin, service social, personnel paramédical,Analyser le contexte de vie d'une personne",,rh@cssr.nc
C1102,2025-05-16,"Conseiller / Conseillère Incendie, Accidents, Risques Divers -IARD-",2025-05-16 10:44:55+00,Dès que possible,Certification Assurance IARD Prévoyance,,1,2025-05-021885,2025-05-16 10:44:55+00,"Bac, bac professionnel",Au moins 3 ans,Nouméa,IFP PATRIMOINE,98807 NOUMEA CEDEX,"Enregistrer et traiter les réclamations des clients et bénéficiaires,Développer et fidéliser la relation client,Établir, mettre à jour un dossier, une base de données,Recueillir et analyser les besoins client,Déclencher des appels à cotisation,Rédiger un contrat d'assurance,Procéder à l'encaissement,Structurer, synthétiser des informations,Présenter et valoriser un produit ou un service,Développer un portefeuille clients et prospects",,brouveyrol@ifp.nc
C1205,2025-05-16,Conseiller / Conseillère en gestion de patrimoine financier,2025-05-16 10:45:40+00,Dès que possible,"finance, gestion ou école de commerce",,2,2025-05-021886,2025-05-16 10:45:40+00,Bac + 5 et plus,Au moins 3 ans,Nouméa,IFP PATRIMOINE,98807 NOUMEA CEDEX,"Établir le bilan patrimonial d'un client,Développer et fidéliser la relation client,Établir, mettre à jour un dossier, une base de données,Rédiger des rapports d'activité,Gérer un patrimoine, un portefeuille d'actifs,Analyser la situation financière d'un client,Déterminer des mesures correctives,Respecter la confidentialité des informations,Développer un portefeuille clients et prospects",,brouveyrol@ifp.nc
J1506,2025-05-16,Infirmier préleveur / Infirmière préleveuse,2025-05-16 11:41:53+00,Dès que possible,Diplôme d'Etat Infirmier,3 mois,1,2025-05-021889,2025-05-16 11:41:53+00,"Bac + 3, bac + 4",Au moins 3 ans,Dumbéa,CALEDOBIO,98845 NOUMEA CEDEX,"Pratiquer des prélèvements sanguins et bactériologiques,Renseigner des documents médico-administratifs,Désinfecter et décontaminer un équipement,Cerner l'état du patient (clinique, psychologique) et consigner les informations recueillies dans le dossier médical,Tenir à jour les dossiers médico-administratifs des patients","Hygiène hospitalière,Démarche de Soins Infirmiers (DSI),Charte des droits du patient",recrutement@caledobio.nc
I1309,2025-04-25,Électricien / Électricienne de maintenance en équipements industriels,2025-04-25 15:16:30+00,Dès que possible,Electrotechnique,6 mois,1,2025-04-021692,2025-04-25 15:16:30+00,Bac +2,Au moins 3 ans,Yaté,CMI KLEIN,98801 NOUMEA CEDEX,"Renseigner, mettre à jour une documentation technique,Concevoir et gérer un projet,Concevoir, améliorer un équipement électrique ou une installation électrique,Superviser des opérations, des actions,Élaborer des règles et procédures de Qualité, Hygiène, Sécurité, Santé et Environnement (QHSSE),Gérer un planning,Contrôler des indicateurs de performance, analyser et corriger des écarts,Accompagner l'appropriation d'un outil par ses utilisateurs,Mettre en oeuvre les processus et les modes opératoires techniques,Renseigner les supports de suivi d'intervention,Utiliser des logiciels spécifiques,Estimer les coûts et les délais d'une activité ou d'une prestation,Optimiser un processus industriel,Gérer les stocks,Apporter une assistance technique,Rédiger un cahier des charges, des spécifications techniques,Suivre une opération de maintenance, de support technique,Contrôler les règles de Qualité, Hygiène, Sécurité, Santé et Environnement (QHSSE),Préparer du matériel en prévision d'un travail,Relever, contrôler, ajuster des mesures et dosages,Transmettre une technique, un savoir-faire,Élaborer un schéma directeur technique, définir des besoins en équipement",,recrutement@johncockerill.nc
J1412,2024-12-16,Psychomotricien / Psychomotricienne,2024-12-16 22:08:29+00,Dès que possible,"Psychomotricien, ergothérapeute",,1,2024-12-020386,2024-12-16 22:08:29+00,Bac +2,Au moins 3 ans,Dumbéa,EAPAD LA CORDYLINE,98837 DUMBEA,"Élaborer des actions ou des règles de prévention,Réaliser un bilan psychomoteur,Procéder aux tests psychomoteurs et analyser les informations recueillies lors de l'évaluation (manifestations cliniques, motivation, ...),Cerner l'environnement du patient (psychologique, familial), répertorier ses difficultés (état des acquisitions, troubles cognitifs, attention) et l'informer sur la démarche psychomotrice,Renseigner des documents médico-administratifs,Concevoir le projet thérapeutique et arrêter les conditions d'intervention, les communiquer au patient ainsi qu'au médecin","Neurophysiologie,Techniques de relaxation,Techniques d'expression corporelle,Pathologies dégénératives,Psychologie du développement,Psychopathologie,Pathologies psychiatriques,Normes rédactionnelles,Techniques pédagogiques",directioncordyline@gmail.com
G1503,2025-06-01,Aide gouvernant / Aide gouvernante en hôtellerie,2025-06-01 14:39:22+00,Dès que possible,,3 mois,1,2025-06-022025,2025-06-01 14:39:22+00,"BEPC, 3ème achevée",Au moins 3 ans,Nouméa,Anonyme,,"Communiquer à l'oral en langue étrangère,Informer, renseigner, orienter une personne sur les prestations et services proposés,Développer et fidéliser la relation client,Diriger et gérer un ensemble, une structure, une organisation,Utiliser les outils bureautiques,Réaliser une veille documentaire,Expliquer et faire respecter les règles et procédures,Respecter les règles de Qualité, Hygiène, Sécurité, Santé et Environnement (QHSSE),Organiser le travail d'une équipe,Transmettre un avis ou une remarque client au service concerné,Contrôler l'état des stocks,Sensibiliser le personnel à l'organisation, la qualité, la sécurité,Approvisionner un chariot de ménage/chariot de linge,Gérer une situation conflictuelle,Entretenir, nettoyer un espace, un lieu, un local,Animer, coordonner une équipe,Analyser, exploiter, structurer des données,Recueillir l'avis et les remarques d'un client,Contrôler l'état de propreté d'un lieu",,gerance.abc.dupropre@gmail.com
M1805,2025-05-29,Analyste-programmeur / Analyste-programmeuse informatique,2025-05-29 10:02:47+00,Dès que possible,,,1,2025-05-022001,2025-05-29 10:02:47+00,Bac +2,Au moins 3 ans,Nouméa,ÂBORO CONSULTING,98845 NOUMEA CEDEX,"Concevoir et gérer un projet,Développer une application en lien avec une base de données,Assembler des composants logiciels,Recueillir et analyser les besoins client,Concevoir et développer une solution digitale,Tester un logiciel, un système d'informations, une application,Identifier les besoins en logiciel,Proposer des pistes d'amélioration des solutions,Coder,Planifier les étapes d'un projet,Sélectionner, assembler et intégrer des composants informatiques (progiciels, bases de données, développements spécifiques, ...),Gérer une situation d'urgence,Paramétrer un logiciel, un outil, un système numérique,Déterminer des mesures correctives,Développer un logiciel, un système d'informations, une application,Évaluer une situation à risque,Analyser, exploiter, structurer des données,Concevoir l'architecture d'un système, d'un réseau,Réaliser un diagnostic technique,Piloter la gestion de la production, de l'exploitation,Comparer des solutions, produits ou matériels",,rachelle.sekeme@aboro.nc
M1810,2025-05-28,Ingénieur / Ingénieure d'exploitation informatique,2025-06-02 07:41:48+00,Dès que possible,,,1,2025-05-021995,2025-05-28 16:03:24+00,Bac +2,Au moins 1 an,Dumbéa,CSB,98845 NOUMEA CEDEX,"Gérer une base de données numériques,Administrer un système d'informations,Diagnostiquer la nature et l'origine des incidents et mettre en oeuvre les mesures correctives,Surveiller le fonctionnement d'espaces disques,Communiquer auprès de ses clients internes et externes,Structurer, synthétiser des informations,Surveiller le fonctionnement de réseaux informatiques et télécom,Contrôler une opération de maintenance,Superviser et organiser les travaux d'exploitation/production informatique,Mener un diagnostic ou un test/essai technique,Contrôler la conformité d'un équipement, d'une machine, d'une installation,Gérer les droits d'accès des utilisateurs,Contrôler le déroulement de travaux,Ordonnancer le déroulement des travaux et mettre en oeuvre les traitements d'exploitation/production des ressources informatiques,Surveiller le fonctionnement d'applicatifs et logiciels,Évaluer la mise en oeuvre d'un projet, plan d'action,Planifier des interventions de maintenance","Normes qualité,Règles de sécurité Informatique et Télécoms,Protection des données numériques,Procédures de maintenance,Normes rédactionnelles,Analyse d'incidents",recrutement@csb.nc
H1102,2025-05-29,Chargé / Chargée d'affaires en industrie,2025-05-29 14:08:46+00,Dès que possible,Bac +5,3 mois,1,2025-05-022009,2025-05-29 14:08:46+00,Bac +2,Au moins 3 ans,Nouméa,AMC,98800 Nouméa,"Élaborer, suivre et piloter un budget,Concevoir et gérer un projet,Développer et fidéliser la relation client,Élaborer, adapter une proposition commerciale,Organiser et planifier une activité,Structurer, synthétiser des informations,Utiliser des logiciels spécifiques,Coordonner les études techniques et les études de prix,Apporter une assistance technique,Rendre compte de son activité,Négocier des solutions techniques ou financières avec un client,Analyser, exploiter, structurer des données,Installer un équipement chez un client,Développer un portefeuille clients et prospects","Progiciels de gestion intégrée d'entreprise (ERP),Conception et Dessin Assistés par Ordinateur (CAO/DAO)",comptabilite@amcsud.nc
I1304,2025-06-02,Technicien / Technicienne de maintenance d'équipements d'exploitation,2025-06-02 15:05:11+00,Dès que possible,"BAC  ELECTROTECHNICIEN ,GENIE CLIMATIQUE",,1,2025-06-022035,2025-06-02 15:05:11+00,Bac +2,Au moins 3 ans,Nouméa,SOCOMETRA,98845 Nouméa Cédex,"Monter et régler une installation, une machine,Réaliser un premier diagnostic de dysfonctionnement et appliquer les mesures correctives,Organiser et planifier une activité,Réaliser des opérations de maintenance à caractère préventif, systématique ou conditionnel,Organiser et programmer les activités et opérations de maintenance,Lire et exploiter un plan, un schéma,Détecter l'origine d'une panne (sur place ou à distance),Détecter les dysfonctionnements des installations, déterminer les causes de panne et établir les demandes d'intervention de maintenance,Apporter une assistance technique,Réparer un équipement, une machine, une installation,Déterminer des mesures correctives,Réaliser un diagnostic technique,Réaliser les réglages de mise au point de l'équipement industriel ou d'exploitation et contrôler son fonctionnement,Réaliser un diagnostic de fonctionnement et contrôler les machines, installations et équipements,Comprendre, interpréter des données et documents techniques,Lire et interpréter des données et documents techniques au besoin en anglais,Respecter des règles, des consignes, normes et procédures opérationnelles,Expliquer et faire respecter les règles et procédures,Planifier une opération de maintenance,Contrôler, surveiller et entretenir régulièrement les équipements,Établir un devis d'intervention,Participer à l'innovation et contribuer à l'amélioration continue du travail,Contrôler le fonctionnement d'un équipement, d'une machine, d'une installation,Organiser ou surveiller des phases de fabrication,Identifier les composants et les pièces défectueuses,Alerter, en qualifiant la nature du problème,Suivre une opération de maintenance, de support technique",,emploi.nc@engie.com
D1212,2025-05-29,Vendeur / Vendeuse en quincaillerie,2025-05-29 10:29:49+00,Dès que possible,"Commerce, Technique",3 mois,2,2025-05-022003,2025-05-29 10:29:49+00,"Bac, bac professionnel",Au moins 1 an,Nouméa,QUINCAILLERIE CALEDONIENNE,98845 Nouméa Cédex,"Informer, renseigner une personne sur les articles en vente,Réaliser l'étiquetage de produits,Développer et fidéliser la relation client,Vendre ou louer des produits ou des services,Gérer une caisse,Procéder à l'encaissement,Définir des besoins en approvisionnement,Réaliser la mise en rayon,Contrôler l'état des stocks,Présenter et valoriser un produit ou un service,Acceuillir, orienter, informer une personne","Produits d'outillage,Techniques de vente,Procédures d'encaissement,Techniques de mise en rayon,Logiciel de gestion de stocks",recrutement@quincaillerie.nc
M1805,2025-06-02,Développeur / Développeuse informatique,2025-06-02 11:19:48+00,Dès que possible,Developpement d'application en RPG-AS400,,1,2025-06-022031,2025-06-02 11:19:48+00,Bac +2,Au moins 1 an,Nouméa,EPI,98800 NOUMEA CEDEX,"Développer une application en lien avec une base de données,Créer une documentation technique,Contrôler la réalisation et les coûts d¿une prestation,Recueillir et analyser les besoins client,Accompagner l'appropriation d'un outil par ses utilisateurs,Préparer et animer une réunion, un groupe de travail, un atelier,Communiquer auprès de ses clients internes et externes,Proposer des pistes d'amélioration des solutions,Piloter le déploiement et l'intégration d'outils d'optimisation au sein des processus métiers,Réaliser des études d'organisation et d'évolution de systèmes d'information,Réaliser des études et développements informatiques,Analyser les indicateurs pertinents sur les tendances et les usages des clients,Réaliser la mise en production de solutions logicielles dans un environnement d'exploitation,Actualiser régulièrement ses connaissances,Enseigner, transmettre des connaissances, développer des compétences,Animer une démarche agile et innovante,Déterminer des mesures correctives,Présenter et valoriser un produit ou un service,Analyser, exploiter, structurer des données,Réaliser un diagnostic technique","Systèmes d'exploitation informatique,SQL,Gestion commerciale, relation clients,Langages de programmation informatique",emploi.nc@engie.com
