coderome,a_pourvoir_le,titre_offre,date_publication,des_que_possible_desc,diplome,duree_contrat,nb_postes,numero,created,niveau_formation,experience,commune_emploi,employeur_nom_entreprise,employeur_adresse_correspondance_subdivision,activites_multivalue,competences_multivalue,contact_mail
M1206,2025-05-07,Chef comptable,2025-05-07 08:32:56+00,Dès que possible,BTS COMPTABILITE/DCG /DSCG/STAGIAIRE EXPERT COMPTABLE,,1,2025-05-021805,2025-05-07 08:32:56+00,"Bac + 3, bac + 4",Au moins 3 ans,Nouméa,FIDEC NC,98847 NOUMEA CEDEX,"Établir des déclarations fiscales et sociales,Établir un état financier",,fidec@fidec.nc
D1401,2025-06-10,Assistant / Assistante administration des ventes,2025-06-10 08:30:07+00,Dès que possible,,,1,2025-06-022102,2025-06-10 08:30:07+00,Bac +2,Au moins 3 ans,Nouméa,ER TRAVAUX,98845 NOUMEA CEDEX,"Assurer un service après-vente,Établir un devis,Effectuer le suivi des commandes, la facturation,Utiliser les outils bureautiques,Assurer la gestion administrative d'une activité,Assurer un accueil téléphonique,Transmettre de l'information",,rh@ert.nc
G1801,2025-05-26,Barman / Barmaid,2025-05-26 10:13:05+00,Dès que possible,,3 mois,1,2025-05-021967,2025-05-26 10:13:05+00,,Au moins 1 an,Nouméa,MV LOUNGE,98800 Nouméa,"Communiquer à l'oral en milieu professionnel,Préparer des boissons chaudes ou froides,Réaliser un service au bar,Changer un fût,Gérer une caisse,Respecter les règles de Qualité, Hygiène, Sécurité, Santé et Environnement (QHSSE),Gérer une situation conflictuelle,Entretenir, nettoyer un espace, un lieu, un local,Communiquer avec l'équipe de salle,Réaliser la mise en place de la salle et de l'office,Prendre une commande client",,rhmvlounge@gmail.com
I1309,2025-06-16,Aide électricien / électricienne de maintenance,2025-06-16 08:31:49+00,Dès que possible,,2 mois,1,2025-06-022141,2025-06-16 08:31:49+00,"Bac, bac professionnel",Au moins 5 ans,Païta,S.I.E,98830 Dumbéa,"Valoriser et partager les bonnes pratiques,Renseigner, mettre à jour une documentation technique,Monter et régler une installation, une machine,Poser un appareil enregistreur,Réaliser une opération de câblage d'armoire électrique,Entretenir, nettoyer un espace, un lieu, un local,Contrôler le fonctionnement d'un équipement, d'une machine, d'une installation,Gérer les stocks,Entretenir un équipement, une machine, une installation,Réparer un équipement, une machine, une installation,Réaliser une intervention nécessitant une habilitation","Électricité,Habilitations électriques de travaux hors tension,Habilitations électriques de travaux sous tension,Utilisation d'appareils de mesure électrique (multimètre, ...),Lecture de plan, de schéma",accueil@sie.nc
G1803,2025-05-09,Serveur / Serveuse de restaurant,2025-05-09 08:11:46+00,Dès que possible,,3 mois,1,2025-05-021822,2025-05-09 08:11:46+00,"Bac, bac professionnel",Au moins 5 ans,Nouméa,ON THE BEACH,98807 NOUMEA CEDEX,"Communiquer à l'oral en langue étrangère,Connaître les process d'ouverture et de fermeture de l'établissement,Communiquer à l'oral en milieu professionnel,Conseiller le client dans ses choix de plats selon ses goûts, les suggestions du jour,Veiller à la satisfaction du client,Effectuer le service des plats à table,Réaliser la mise en place de la salle et de l'office,Accueillir le client et l'installer,Préparer des boissons chaudes ou froides,Réaliser un service au bar,Gérer une situation conflictuelle,Entretenir, nettoyer un espace, un lieu, un local,Animer, coordonner une équipe,Réceptionner des produits, des matières premières, vérifier la conformité d'une livraison,Respecter des règles, des consignes, normes et procédures opérationnelles,Procéder à l'encaissement,Respecter les règles de Qualité, Hygiène, Sécurité, Santé et Environnement (QHSSE),Renseigner le client sur la composition des produits, allergènes, provenance,Effectuer le suivi des réservations,Enregistrer et traiter les réclamations des clients et bénéficiaires,Présenter la carte des vins, conseiller les clients sur l'accord mets/vin,Mémoriser des informations,Préparer, assembler des plats simples,Prendre une commande client,Évacuer, recycler des déchets, des produits","Utilisation de matériel de bar,Lecture de plan de salle,Techniques de dressage de table,Techniques du service en salle,Techniques de service des plats,Techniques de port de plateaux/plats,Caractéristiques des vins et spiritueux,Critères de tri sélectif,Utilisation de caisse informatisée,Techniques de service à l'assiette,Règles d'hygiène et de sécurité alimentaire",otbnoumea@gmail.com
M1805,2025-05-09,Développeur / Développeuse informatique,2025-05-09 13:31:20+00,Dès que possible,,,1,2025-05-021826,2025-05-09 13:31:20+00,"Bac + 3, bac + 4",Au moins 1 an,Nouméa,DIGIT,98857 NOUMEA CEDEX,"Rédiger une Spécification Technique de Besoin (STB),Communiquer auprès de ses clients internes et externes,Proposer des pistes d'amélioration des solutions,Déterminer les phases et procédures de tests techniques et fonctionnels de programmes et applications informatiques,Gérer et déployer des logiciels à distance,Coder,Déterminer des mesures correctives,Analyser des problèmes techniques,Réaliser un prototype de la solution technique pour validation par le donneur d'ordres (configuration type, ...),Concevoir et développer les programmes et applications informatiques,Analyser, exploiter, structurer des données,Rédiger un cahier des charges, des spécifications techniques,Réaliser un diagnostic technique,Intégrer des outils IA/Data Science,Garantir le bon fonctionnement, la disponibilité et la performance d'une solution logicielle,Concevoir et développer une solution digitale,Recueillir et analyser les besoins client,Tester un logiciel, un système d'informations, une application,Identifier les besoins en logiciel,Analyser les besoins du client,Établir un cahier des charges,Réaliser des études et développements informatiques,Réaliser des supports techniques,Créer, élaborer et identifier des concepts innovants,Paramétrer un logiciel, un outil, un système numérique,Développer un logiciel, un système d'informations, une application,Concevoir un équipement selon ses usages et contraintes,Surveiller le fonctionnement d'applicatifs et logiciels,Respecter la confidentialité des informations,Programmer dans un langage informatique spécifique","Architecture d'applications,Systèmes d'exploitation informatique,Progiciels de gestion intégrée d'entreprise (ERP),Architecture des systèmes d'information,Programmation logicielle,Règles de sécurité Informatique et Télécoms,Modélisation informatique,Programmation informatique,Application web,Gestion de configuration,Langage informatique CSS,Langage informatique Java,Langage informatique SQL,Langage informatique J2EE,Langage informatique HTML",drh@sf2i.nc
I1604,2025-06-04,Préparateur réparateur / Préparatrice réparatrice véhicules de loisirs,2025-06-04 09:02:57+00,Dès que possible,,3 mois,1,2025-06-022050,2025-06-04 09:02:57+00,"CAP, BEP",Au moins 3 ans,Nouméa,GARAGE DE NUMBO,98846 Nouméa Cédex,"Réparer un véhicule,Réaliser des opérations de carrosserie ou de peinture,Évacuer, recycler des déchets, des produits,Installer des équipements complémentaires (dispositifs de confort, protection, films teintés, attelage, ...) sur un véhicule automobile particulier ou industriel",,garagedenumbo@hotmail.fr
J1506,2025-05-07,Infirmier / Infirmière en gériatrie,2025-05-07 15:54:35+00,Dès que possible,Diplôme d'état infirmier,,1,2025-05-021815,2025-05-07 15:54:35+00,"Bac + 3, bac + 4",Au moins 1 an,Dumbéa,GABRIELLA,98835 DUMBEA,"Pratiquer des soins palliatifs,Pratiquer un suivi des pathologies chroniques stabilisées,Réaliser des soins d'hygiène corporelle, de confort et de prévention,Réaliser un prélèvement biologique,Désinfecter et décontaminer un équipement,Pratiquer des prises en charge de la douleur,Surveiller l'état de santé d'une personne,Réaliser des soins infirmiers",,gabriella@maisonderetraite.nc
K2102,2025-06-12,Coordinateur / Coordinatrice pédagogique,2025-06-12 19:53:25+00,Dès que possible,,11 mois,1,2025-06-022132,2025-06-12 19:53:25+00,"Bac + 3, bac + 4",Au moins 1 an,Nouméa,BUREAU WWF NOUVELLE CALEDONIE,98853 Nouméa Cédex,"Concevoir l'ingénierie de formation et les séquences pédagogiques,Concevoir et gérer un projet,Définir des ressources pédagogiques,Superviser des opérations, des actions,Adapter un dispositif de formation selon les évolutions pédagogiques, sociales, économiques et techniques,Utiliser les outils bureautiques,Préparer et animer une réunion, un groupe de travail, un atelier,Enseigner, transmettre des connaissances, développer des compétences","Caractéristiques socio-culturelles des publics,Marketing / Mercatique,Techniques pédagogiques",
D1214,2025-05-27,Vendeur / Vendeuse en prêt-à-porter féminin,2025-05-27 14:30:13+00,Dès que possible,,3 mois,1,2025-05-021983,2025-05-27 14:30:13+00,"Bac, bac professionnel",Au moins 1 an,Nouméa,SUN AND THE CITY,98857 NOUMEA CEDEX,"Développer et fidéliser la relation client,Gérer une caisse,Procéder à l'encaissement,Entretenir, nettoyer un espace, un lieu, un local,Vendre des produits ou services,Encaisser le montant d'une vente,Contrôler l'état des stocks,Réceptionner un produit,Acceuillir, orienter, informer une personne","Argumentation commerciale,Techniques de vente,Procédures d'encaissement,Principes de la relation client",contact@sunandthecity.nc
G1803,2025-05-27,Chef de rang,2025-05-27 14:33:38+00,Dès que possible,,,1,2025-05-021984,2025-05-27 14:33:38+00,Aucune formation scolaire,Au moins 3 ans,Nouméa,THE BEACH HOUSE,98845,"Communiquer à l'oral en langue étrangère,Connaître les process d'ouverture et de fermeture de l'établissement,Communiquer à l'oral en milieu professionnel,Conseiller le client dans ses choix de plats selon ses goûts, les suggestions du jour,Veiller à la satisfaction du client,Effectuer le service des plats à table,Réaliser la mise en place de la salle et de l'office,Accueillir le client et l'installer,Préparer des boissons chaudes ou froides,Réaliser un service au bar,Gérer une situation conflictuelle,Entretenir, nettoyer un espace, un lieu, un local,Animer, coordonner une équipe,Réceptionner des produits, des matières premières, vérifier la conformité d'une livraison,Respecter des règles, des consignes, normes et procédures opérationnelles,Procéder à l'encaissement,Respecter les règles de Qualité, Hygiène, Sécurité, Santé et Environnement (QHSSE),Renseigner le client sur la composition des produits, allergènes, provenance,Utiliser des logiciels spécifiques,Effectuer le suivi des réservations,Enregistrer et traiter les réclamations des clients et bénéficiaires,Présenter la carte des vins, conseiller les clients sur l'accord mets/vin,Mémoriser des informations,Préparer, assembler des plats simples,Prendre une commande client,Évacuer, recycler des déchets, des produits",,
J1404,2025-05-15,Kinésithérapeute,2025-05-15 10:08:48+00,Dès que possible,Diplôme d'Etat masseur-kinésithérapeute,6 mois,2,2025-05-021865,2025-05-15 10:08:48+00,Bac + 5 et plus,Au moins 1 an,Dumbéa,SAS CALEDONIE SANTE - CSSR,98835 DUMBEA,"Proposer des conseils en matière de bien-être et d'hygiène de vie,Concevoir un projet thérapeutique,Organiser la séance de kinésithérapie et l'adapter,Détecter des contre-indications suite à des fractures, des infections osseuses et orienter le patient vers un médecin, psychologue, ...,Contrôler la conformité d'un équipement, d'une machine, d'une installation,Poser un appareillage médical,Rédiger un rapport, un compte rendu d'activité,Renseigner des documents médico-administratifs,Enseigner, transmettre des connaissances, développer des compétences,Réaliser le diagnostic masso kinésithérapique (bilan des déficiences, ...) à partir de tests de force musculaire, de posture, ... et le présenter au patient,Identifier le besoin du patient et échanger des informations (traitements en cours, antécédents médicaux, radiographies, ...)",,rh@cssr.nc
G1803,2025-05-30,Serveur / Serveuse en restauration,2025-05-30 14:20:01+00,Dès que possible,Diplôme en Hôtellerie/Restauration,3 mois,1,2025-05-022018,2025-05-30 14:20:01+00,"CAP, BEP",Au moins 1 an,Nouméa,MALONGO CAFE STORE,98800 Nouméa,"Effectuer le service de plats à table selon les techniques spécifiques (à l'assiette, à la française, à l'anglaise, ...),Préparer des boissons chaudes ou froides,Réaliser un service au bar,Optimiser les consommations d'énergie,Lutter contre le gaspillage alimentaire,Traiter une commande,Accueillir le client et l'installer,Réaliser un service en salle,Entretenir, nettoyer un espace, un lieu, un local,Communiquer avec l'équipe de salle,Connaître les process d'ouverture et de fermeture de l'établissement,Communiquer à l'oral en milieu professionnel,Conseiller le client dans ses choix de plats selon ses goûts, les suggestions du jour,Dresser les tables,Réaliser la mise en place de la salle et de l'office,Mémoriser des informations,Encaisser le montant d'une vente,Accueillir le client à son arrivée au restaurant, l'installer à une table et lui présenter la carte,Conseiller le client dans ses choix de plats selon ses goûts, les suggestions du jour et prendre sa commande,Procéder à l'encaissement,Respecter les règles de Qualité, Hygiène, Sécurité, Santé et Environnement (QHSSE),Utiliser des logiciels spécifiques,Renseigner le client sur la composition des produits, allergènes, provenance,Veiller à la satisfaction d'un client,Effectuer le suivi des réservations,Saisir une commande sur informatique,Enregistrer et traiter les réclamations des clients et bénéficiaires,Débarrasser une table,Nettoyer une salle de réception,Préparer des plats simples (salades, assiette de crudités, de fromages, desserts, ...),Réceptionner et contrôler des produits (quantité, conformité, état, ...),Réaliser l'entretien des verres et des couverts (à la vapeur, au vinaigre, ...) et le rangement de la vaisselle,Ranger une réserve","Utilisation de matériel de bar,Lecture de plan de salle,Techniques de comptage,Typologie du client,Préparations culinaires de base,Règles et consignes de sécurité,Techniques de dressage de table,Procédures d'encaissement,Techniques du service en salle,Techniques de port de plateaux/plats,Techniques de service des plats,Langue étrangère - Anglais,Caisse informatisée,Techniques de service à l'assiette,Techniques de mémorisation,Règles d'hygiène et de sécurité alimentaire",cv@cafestore.nc
D1407,2025-05-28,Attaché technico-commercial / Attachée technico-commerciale,2025-05-28 07:42:17+00,Dès que possible,Commerce / vente,3 mois,1,2025-05-021989,2025-05-28 07:42:17+00,Bac +2,Au moins 5 ans,Nouméa,QUINCAILLERIE CALEDONIENNE,98845 Nouméa Cédex,"Développer et fidéliser la relation client,Établir un plan de tournée de prospection (ciblage, interlocuteurs, préparation de dossiers techniques),Mettre en oeuvre des actions commerciales et promotionnelles,Établir un devis,Effectuer le suivi des commandes, la facturation,Établir un contrat de vente,Analyser les résultats des ventes,Négocier un contrat,Réaliser une étude d'opportunité et de faisabilité technique et économique,Élaborer une stratégie commerciale,Évaluer la mise en oeuvre d'un projet, plan d'action","Logiciel de gestion clients,Typologie du client,Techniques commerciales",recrutement@quincaillerie.nc
K2204,2025-05-06,Agent / Agente d'entretien/propreté de locaux,2025-05-06 12:47:59+00,Dès que possible,,1 mois,1,2025-05-021789,2025-05-06 12:47:59+00,Aucune formation scolaire,Moins d'1 an,Nouméa,HESTIA SARL,98807 NOUMEA CEDEX,"Sécuriser le périmètre d'intervention,Organiser et planifier une activité,Sélectionner les produits et matériels de nettoyage adaptés,Doser des produits d'entretien,Éliminer par aération, désodorisation, les pollutions de lieux,Définir des besoins en approvisionnement,Entretenir, nettoyer un espace, un lieu, un local,Entretenir un équipement, une machine, une installation,Vérifier le contenu du chariot de ménage et procéder à la préparation des solutions de nettoyage,Identifier, traiter une demande client,Vérifier la conformité d'une réalisation avec un cahier des charges,Répondre aux attentes d'un client,Appliquer les principes du bio-nettoyage,Adapter et optimiser sa pratique aux risques professionnels (gestes, postures, ergonomie),Comprendre, interpréter des données et documents techniques,Contrôler l'état des stocks,Nettoyer, désinfecter et ranger la chambre et l'installation sanitaire,Baliser les zones glissantes,Entretenir une surface, un sol,Désinfecter et décontaminer des locaux sensibles,Transmettre de l'information,Entretenir, nettoyer un produit ou du matériel,Alerter, en qualifiant la nature du problème,Évacuer, recycler des déchets, des produits,Préparer du matériel en prévision d'un travail,Utiliser une installation, une machine,Laver des vitres",,info@hestia.nc
D1101,2025-06-10,Aide-boucher / Aide-bouchère,2025-06-10 12:38:04+00,Dès que possible,CAP BOUCHERIE,21 jours,2,2025-06-022112,2025-06-10 12:38:04+00,"CAP, BEP",Au moins 3 ans,Dumbéa,AUCHAN AUTEUIL,98846 NOUMEA CEDEX,"Conditionner des produits,Trier des pièces de viande,Entretenir, nettoyer un espace, un lieu, un local,Découper, désosser, parer de la viande,Entretenir un équipement, une machine, une installation,Prendre une commande client,Organiser, aménager un espace de vente",,respadm@auchanauteuil.nc
F1607,2025-05-12,Monteur techniverrier / Monteuse techniverrière,2025-05-12 07:44:14+00,Dès que possible,menuiserie,3 mois,2,2025-05-021831,2025-05-12 07:44:14+00,"CAP, BEP",Au moins 1 an,Nouméa,ER TRAVAUX,98845 NOUMEA CEDEX,"Adapter et optimiser sa pratique aux risques professionnels (gestes, postures, ergonomie),Conditionner des produits,Assembler des matériaux, des produits,Réaliser l'étanchéité de l'ensemble support/châssis et poser les mousses de polyuréthane, joints, bandes adhésives, cornières, ...,Respecter des règles, des consignes, normes et procédures opérationnelles,Évaluer, prévenir, et gérer les risques et la sécurité,Respecter les règles de Qualité, Hygiène, Sécurité, Santé et Environnement (QHSSE),Démonter une fermeture menuisée et vérifier l'état du support,Installer une serrure et des accessoires de fermeture,Entretenir, nettoyer un produit ou du matériel,Alerter, en qualifiant la nature du problème,Charger, décharger, manutentionner des produits,Évacuer, recycler des déchets, des produits",,rh@ert.nc
J1506,2025-05-21,Infirmier coordinateur / Infirmière coordinatrice en établissement de soins,2025-05-21 14:27:32+00,Dès que possible,Infirmier diplôme d'état,,1,2025-05-021938,2025-05-21 14:27:32+00,Bac + 5 et plus,Au moins 3 ans,Païta,Résidence des Pavillons d'Eugénie,98890,"Pratiquer des soins palliatifs,Réaliser des soins d'hygiène corporelle, de confort et de prévention,Réaliser un prélèvement biologique,Pratiquer un suivi en stomatothérapie,Désinfecter et décontaminer un équipement,Installer à domicile du matériel médical (lit médicalisé, appareil d'assistance respiratoire, ...) et en expliquer le fonctionnement,Renseigner des documents médico-administratifs,Réaliser des opérations comptables,Pratiquer des soins de psychiatrie et de santé mentale,Pratiquer un suivi des pathologies chroniques stabilisées,Informer un patient,Pratiquer des soins en oncologie,Pratiquer une prise en charge de la maladie rénale chronique,Coordonner des programmes d'éducation thérapeutique de patients atteints de maladies chroniques,Assurer la gestion administrative d'une activité,Pratiquer des prises en charge de la douleur,Pratiquer une hémodialyse,Animer, coordonner une équipe,Préparer, installer un dispositif médico-technique,Surveiller l'état de santé d'une personne,Analyser des résultats d'examen médicaux,Réaliser des soins infirmiers","Protocoles de lutte contre les infections nosocomiales,Identification des signes et du degré de la douleur,Techniques d'hémodialyse,Charte des droits du patient,Bonnes pratiques de dispensation de l'oxygène - BPDO,Pathologies du vieillissement,Hygiène hospitalière,Pathologies psychiatriques,Protocoles de soins pré et post-opératoires,Formulaires de prise en charge d'hospitalisation à domicile,Produits Sanguins Labiles (PSL),Méthodes de décontamination de matériel,Démarche de Soins Infirmiers (DSI),Modalités de prise en charge de patients en fin de vie,Bonnes Pratiques Transfusionnelles -BPT-,Protocoles de soins d'urgence,Psychologie,Règles d'hygiène et d'asepsie",direction@rpe.nc
D1507,2025-06-11,Employé / Employée de libre-service,2025-06-11 09:26:04+00,Dès que possible,,1 mois,1,2025-06-022115,2025-06-11 09:26:04+00,,Moins d'1 an,Mont-Dore (Le),GE2B,98860 KONE,"Informer, renseigner une personne sur les articles en vente,Réaliser l'étiquetage de produits,Procéder à l'encaissement,Définir des besoins en approvisionnement,Contrôler le balisage et l'étiquetage des produits en rayon,Réceptionner des produits, des matières premières, vérifier la conformité d'une livraison","Techniques de vente,Procédures d'encaissement,Utilisation de matériel de nettoyage,Techniques de mise en rayon",cvgevkpp@gmail.com
G1301,2025-04-14,Forfaitiste,2025-04-14 10:08:42+00,Dès que possible,,6 mois,4,2025-04-021601,2025-04-14 10:08:42+00,Aucune formation scolaire,Au moins 3 ans,Nouméa,LYVAI TOUR,98802 Nouméa Cedex,"Sélectionner un support de diffusion,Contrôler la réalisation d'une prestation,Déterminer la programmation du produit touristique et établir le descriptif des sites à visiter, des formalités pratiques, des modalités de vente,Concevoir une prémaquette publicitaire,Recueillir et analyser les informations sur les prestations des partenaires (hôteliers, autocaristes, compagnies aériennes, ...),Actualiser la documentation professionnelle et réglementaire","Réglementation du tourisme,Marketing / Mercatique,Géographie du tourisme",societe@holding3lg.nc
J1502,2025-05-06,Infirmier général / Infirmière générale,2025-05-06 16:18:54+00,Dès que possible,Diplôme d'Etat d'Infirmier,6 mois,1,2025-05-021800,2025-05-06 16:18:54+00,"Bac + 3, bac + 4",Au moins 1 an,Dumbéa,SAS CALEDONIE SANTE - CSSR,98835 DUMBEA,"Représenter sa structure lors d'un événement ou auprès d'instances de décision,Concevoir des protocoles de soins,Apporter un appui technique pour le personnel,Rédiger un rapport, un compte rendu d'activité","Protocoles de soins,Soins infirmiers,Règles d'hygiène et d'asepsie",rh@cssr.nc
M1608,2025-05-28,Secrétaire comptable,2025-05-28 16:18:50+00,Dès que possible,BTS,,1,2025-05-021996,2025-05-28 16:18:50+00,Bac +2,Au moins 3 ans,Nouméa,AXA,98846 NOUMEA CEDEX,"Concevoir des supports de suivi et de gestion,Établir, mettre à jour un dossier, une base de données,Utiliser les outils bureautiques,Effectuer le suivi des commandes, la facturation,Gérer la trésorerie, le recouvrement,Structurer, synthétiser des informations,Rédiger un rapport, un compte rendu d'activité,Assurer un accueil téléphonique,Contrôler l'état des stocks,Réaliser des opérations comptables,Définir des besoins en approvisionnement,Établir un état de rapprochement bancaire,Classer des documents,Organiser le traitement des commandes,Acceuillir, orienter, informer une personne","Méthode de classement et d'archivage,Comptabilité générale,Logiciels comptables",ressourceshumaines.noumeacentre@axa.nc
J1405,2025-05-05,Opticien / Opticienne,2025-05-05 07:55:22+00,Dès que possible,BTS OL,,1,2025-05-021762,2025-05-05 07:55:22+00,Bac +2,Au moins 1 an,Nouméa,OPTIQUE DUBOIS,98800 Nouméa,"Conseiller, accompagner une personne,Procéder à des examens visuels,Préparer les verres (centrage, axage, montage, ...), procéder à l'essayage sur le client et effectuer les ajustements,Prendre les mesures pour la réalisation de l'équipement optique et établir la fiche d'exécution des travaux,Enseigner, transmettre des connaissances, développer des compétences",,direction@optiquedubois.nc
I1401,2025-06-11,Technicien / Technicienne en téléassistance en informatique,2025-06-11 12:15:43+00,Dès que possible,,,1,2025-06-022117,2025-06-11 12:15:43+00,"Bac + 3, bac + 4",Au moins 10 ans,Nouméa,XL PROG / XL NET / COMPTA XL / STOCK XL / PAIE XL,98847 NOUMEA CEDEX,"Démonter un équipement, une installation,Réaliser un câblage réseau de matériels informatiques ou bureautiques,Élaborer, adapter une proposition commerciale,Réaliser les opérations de nettoyage et de réglage sur les matériels et équipements,Configurer le poste de travail aux besoins de l'utilisateur,Installer ou configurer un serveur réseau,Dépanner des équipements informatiques,Estimer les coûts et les délais d'une activité ou d'une prestation,Recycler des composants électroniques,Gérer les stocks,Changer ou réparer une pièce ou un ensemble défectueux,Apporter une assistance technique,Analyser, résoudre un problème courant ou complexe,Animer, coordonner une équipe,Transmettre de l'information,Installer un équipement chez un client,Réaliser une configuration standard sur un poste de travail,Diagnostiquer à distance un dysfonctionnement informatique matériel ou logiciel,Intégrer des composants d'équipements informatiques ou bureautiques",,rh@xlprog.nc
