coderome,a_pourvoir_le,titre_offre,date_publication,des_que_possible_desc,diplome,duree_contrat,nb_postes,numero,created,niveau_formation,experience,commune_emploi,employeur_nom_entreprise,employeur_adresse_correspondance_subdivision,activites_multivalue,competences_multivalue,contact_mail
C1102,2026-02-26,Chargé / Chargée de clientèle en assurances,2026-02-26 09:16:39+00,Dès que possible,"BTS ASSURANCE, BTS NRC",3 mois,1,2026-02-024465,2026-02-26 09:16:39+00,Bac +2,Au moins 1 an,Mont-Dore (Le),CENTRE D'ETUDES D'ASSURANCES NOUMEA,98800,"Développer et fidéliser la relation client,Établir, mettre à jour un dossier, une base de données,Recueillir et analyser les besoins client,Déclencher des appels à cotisation,Procéder à l'encaissement,Structurer, synthétiser des informations,Concevoir un devis ou un projet de contrat,Contrôler des pièces et justificatifs d'un dossier pour détecter une éventuelle fraude,Promouvoir une proposition, un projet,Conduire un entretien de vente,Enregistrer et traiter les réclamations des clients et bénéficiaires,Rassembler les justificatifs et transmettre la proposition d'assurance pour décision,Rédiger un contrat d'assurance,Contrôler la conformité des données ou des documents,Présenter et valoriser un produit ou un service,Développer un portefeuille clients et prospects",,laurence.chenu@cea-assurances.nc
H1102,2026-02-26,Chargé / Chargée d'affaires en industrie,2026-02-26 11:57:12+00,Dès que possible,Bac +5,3 mois,1,2026-02-024473,2026-02-26 11:57:12+00,Bac +2,Au moins 3 ans,Nouméa,AMC,98800 Nouméa,"Élaborer, suivre et piloter un budget,Concevoir et gérer un projet,Développer et fidéliser la relation client,Élaborer, adapter une proposition commerciale,Organiser et planifier une activité,Structurer, synthétiser des informations,Utiliser des logiciels spécifiques,Coordonner les études techniques et les études de prix,Apporter une assistance technique,Rendre compte de son activité,Négocier des solutions techniques ou financières avec un client,Analyser, exploiter, structurer des données,Installer un équipement chez un client,Développer un portefeuille clients et prospects","Progiciels de gestion intégrée d'entreprise (ERP),Conception et Dessin Assistés par Ordinateur (CAO/DAO)",comptabilite@amcsud.nc
D1401,2026-03-20,Assistant / Assistante des ventes,2026-03-06 13:51:17+00,"",,3 mois,1,2026-03-024552,2026-03-06 13:51:17+00,"Bac, bac professionnel",Au moins 3 ans,Nouméa,PACIFIC CARE,98895 NOUMEA CEDEX,"Assurer un service après-vente,Développer et fidéliser la relation client,Établir, mettre à jour un dossier, une base de données,Mettre en oeuvre des actions commerciales et promotionnelles,Utiliser les outils bureautiques,Effectuer le suivi des commandes, la facturation,Assurer un accueil téléphonique,Vérifier les conditions de réalisation d'une commande,Établir un devis,Assurer la gestion administrative d'une activité,Transmettre de l'information,Réaliser une étude technique et commerciale,Déterminer des mesures correctives,Acceuillir, orienter, informer une personne,Développer un portefeuille clients et prospects,Suivre une audience Web","Marketing après-vente,Logiciel de gestion clients,Approvisionnement en ligne / E achat,Outils de web analyse - web analytics,Prospection commerciale,Techniques de vente,Typologie du client,Bon de livraison,Techniques commerciales,Normes rédactionnelles",rh@pacific-care.nc
F1602,2026-02-27,Électricien / Électricienne photovoltaïque,2026-02-27 09:28:48+00,Dès que possible,,6 mois,1,2026-02-024481,2026-02-27 09:28:48+00,Bac +2,Au moins 3 ans,Nouméa,ÂBORO CONSULTING,98845 NOUMEA CEDEX,"Contrôler la qualité et la conformité d'un bâtiment, d'une infrastructure,Anticiper des dangers, problèmes ou besoins matériels et techniques,Analyser une situation et produire un diagnostic,Prendre une décision et l'expliquer,Organiser et planifier une activité,Équiper une armoire électrique industrielle,Mettre en place les capteurs solaires thermiques ou modules photovoltaïques en intégré ou sur la toiture afin d'optimiser la consommation d'énergie,Réaliser une veille technique ou technologique pour anticiper les évolutions,Contrôler une installation électrique,Changer ou réparer une pièce ou un ensemble défectueux,Animer, coordonner une équipe,Répondre aux attentes d'un client,Fixer des éléments basse tension,Régler et contrôler les installations,Réaliser un diagnostic technique,Tirer les câbles courants et spécifiques,Transmettre une technique, un savoir-faire,Adapter et optimiser sa pratique aux risques professionnels (gestes, postures, ergonomie),Renseigner, mettre à jour une documentation technique,Réaliser des supports et des armoires électriques,Élaborer des processus et des modes opératoires techniques,Respecter les règles de Qualité, Hygiène, Sécurité, Santé et Environnement (QHSSE),Rédiger un rapport, un compte rendu d'activité,Installer un équipement électronique,Utiliser des logiciels spécifiques,Réaliser une intervention nécessitant une habilitation,Mettre en place de petits appareillages B.T. tels que prises de courant, appareils d'éclairage, de commande, de coupure, de chauffage,Installer un système électrique,Transmettre de l'information,Contrôler l'état d'avancement des travaux,Évaluer une situation à risque",,rachelle.sekeme@aboro.nc
D1106,2026-04-01,Vendeur / Vendeuse en boulangerie-pâtisserie,2026-02-27 10:55:09+00,"",,3 mois,1,2026-02-024483,2026-02-27 10:55:09+00,,Aucune expérience professionnelle,Nouméa,Anonyme,,"Réceptionner des produits, des matières premières, vérifier la conformité d'une livraison,Conditionner des produits,Informer, renseigner une personne sur les articles en vente,Vendre ou louer des produits ou des services,Réaliser l'emballage de produits frais,Utiliser les outils bureautiques,Renseigner le support de suivi de traçabilité des marchandises,Procéder à l'encaissement,Réaliser la mise en rayon,Contrôler l'état des stocks,Retirer des produits non conformes,Livrer une commande,Gérer une caisse,Assurer la gestion administrative d'une activité,Préparer, assembler des plats simples,Présenter et valoriser un produit ou un service,Organiser, aménager un espace de vente,Communiquer à l'oral en milieu professionnel,Réaliser un inventaire,Transformer un produit frais (cuire, couper, préparer un plateau...),Ranger des produits ou marchandises selon leurs dates de validité et les conditions de conservation,Réaliser des opérations comptables,Mettre en place/rafraîchir l'étal (glace, décoration), disposer les produits et afficher les prix,Contrôler l'état de conservation d'un produit périssable,Définir des besoins en approvisionnement,Entretenir, nettoyer un espace, un lieu, un local,Entretenir un équipement, une machine, une installation,Organiser le traitement des commandes,Prévenir et résoudre les conflits,Répondre aux attentes d'un client",,laptiteboulangerienc@gmail.com
H2909,2026-02-27,Monteur / Monteuse d'assemblage mécanique de précision,2026-03-02 07:05:17+00,Dès que possible,,1 an(s),6,2026-02-024490,2026-02-28 05:56:55+00,"Bac, bac professionnel",Au moins 1 an,Yaté,Anonyme,,"Contrôler la qualité et la conformité d'un produit,Vérifier le montage/assemblage (aspect, parallélisme, jeu, maintien, fonctionnement, ...) et procéder aux ajustements, retouches,Comprendre, interpréter des données et documents techniques,Monter et régler une installation, une machine,Réaliser la finition d'un produit, d'un article, d'un ouvrage,Réaliser des opérations de montage, d'assemblage et démontage,Surveiller l'assemblage de pièces,Identifier les opérations de montage, assemblage, retouche,Vérifier, positionner et fixer les pièces et les éléments de l'assemblage (bâtis, grappes, gabarits, structures, ...),Retirer des produits non conformes,Installer des gaines et câblages,Réduire l'empreinte environnementale de son activité,Définir les paramètres des machines, des équipements,Contrôler la conformité d'un équipement, d'une machine, d'une installation,Participer à un travail collaboratif,Injecter un matériau (mousse, isolant, résine, colle, ...) lors du montage/assemblage,Réaliser la mise au point des machines et outillages de production,Surveiller l'approvisionnement des machines, des installations et le flux des matières ou des produits,Identifier des non-conformités,Manipuler un engin de manutention ou de chantier","Indicateurs de suivi d'activité,Normes qualité,Indicateurs de suivi de production,Règles de sécurité,Lecture de plan, de schéma",marinau.nc@gmail.com
D1202,2026-02-28,Assistant / Assistante de coiffure,2026-02-28 21:53:16+00,Dès que possible,,1 mois,1,2026-02-024495,2026-02-28 21:53:16+00,"CAP, BEP",Moins d'1 an,Nouméa,Sarl tropical beauty by Eriknana,98800 Nouméa,"Développer et fidéliser la relation client,Réaliser le diagnostic capillaire, les préparations du lavage et le shampoing,Réaliser des prestations de coiffure,Réaliser une coupe ou une coiffure,Définir des besoins en approvisionnement,Présenter au client sa coiffure sous différents angles pour recueillir son avis,Entretenir, nettoyer un espace, un lieu, un local,Contrôler l'état des stocks,Vendre une prestation ou un produit,Présenter et valoriser un produit ou un service,Entretenir un outil ou matériel",,tropicalbeauty.nc@gmail.com
F1106,2026-03-09,Ingénieur / Ingénieure travaux,2026-03-09 13:22:35+00,Dès que possible,,,1,2026-03-024564,2026-03-09 11:29:40+00,Bac + 5 et plus,Au moins 5 ans,Dumbéa,SECAL,98846 NOUMEA CEDEX,"Mettre en place des solutions d'amélioration de la performance,Contrôler la qualité et la conformité d'un bâtiment, d'une infrastructure,Communiquer à l'oral en milieu professionnel,Piloter la performance et la rentabilité d'une activité ou d'un projet,Élaborer, adapter une proposition commerciale,Gérer une base documentaire,Optimiser les effectifs, l'adéquation et l'allocation des ressources,Lancer et gérer un appel d'offres,Organiser et conduire des travaux, un chantier,Superviser et contrôler l'exécution d'études, de documents et de plans de détails confiés aux bureaux d'études,Inventorier les contraintes de construction d'un ouvrage,Animer, coordonner une équipe,Rédiger un cahier des charges, des spécifications techniques,Évaluer la mise en oeuvre d'un projet, plan d'action,Représenter sa structure lors d'un événement ou auprès d'instances de décision,Renseigner, mettre à jour une documentation technique,Évaluer et développer les compétences de ses collaborateurs,Créer une documentation technique,Comprendre, interpréter des données et documents techniques,Favoriser l'entente, la communication et relayer les informations,Coordonner l'ensemble des acteurs du projet pour la bonne réalisation du plan d'exécution,Préparer et animer une réunion, un groupe de travail, un atelier,Analyser les données d'une étude, d'un projet,Prospecter de nouveaux clients, de nouveaux marchés,Transmettre de l'information,Collecter et analyser des informations","Cahier des Clauses Techniques Particulières -CCTP-,Normes de la construction,Cahier des Clauses Administratives Particulières (CCAP),Droit de l'urbanisme et de la construction,Analyse du Cycle de Vie - ACV des produits,Économie de la construction,Chiffrage/calcul de coût,Construction durable (Écoconstruction)",emploi@secal.nc
M1205,2026-03-09,Responsable administratif et financier / administrative et financière,2026-03-09 13:15:03+00,Dès que possible,,,1,2026-03-024567,2026-03-09 11:49:38+00,Bac + 5 et plus,Au moins 5 ans,Dumbéa,SECAL,98846 NOUMEA CEDEX,"Déployer, intégrer un logiciel, un système d'informations, une application,Élaborer, suivre et piloter un budget,Définir la stratégie des systèmes d'informations,Conseiller une organisation, une structure,Piloter une activité,Gérer la relation avec les fournisseurs, sous-traitants, prestataires,Gérer la trésorerie, le recouvrement,Superviser les procédures de gestion financière,Définir la stratégie financière d'une structure,Mettre en oeuvre un contrôle de gestion, un audit interne,Réaliser des opérations comptables,Calculer les marges, la rentabilité d'un produit ou d'une activité,Traiter des dossiers de contentieux,Superviser l'action de conseils juridiques,Réaliser des actions de négociation avec des financeurs,Présenter un budget,Assurer la gestion administrative d'une activité,Réaliser la gestion des déplacements professionnels,Gérer les ressources humaines,Coordonner et superviser la gestion du patrimoine mobilier et immobilier,Élaborer une stratégie commerciale","Comptabilité générale,Droit des sociétés,Méthode de Gestion Prévisionnelle des Emplois et des Compétences -GPEC-,Normes qualité,Comptabilité analytique,Droit des affaires,Fiscalité,Réglementation bancaire,Analyse des risques financiers,Législation sociale,Droit du travail,Comptabilité publique,Audit comptable et financier,Droit commercial",emploi@secal.nc
G1801,2026-02-24,Barman / Barmaid,2026-02-24 11:19:08+00,Dès que possible,,,1,2026-02-024434,2026-02-24 11:19:08+00,"CAP, BEP",Au moins 1 an,Nouméa,Anonyme,,,,emploi@edgysarlsarl.com
D1401,2026-02-24,Assistant commercial / Assistante commerciale,2026-02-24 10:57:47+00,Dès que possible,,,1,2026-02-024429,2026-02-24 10:57:47+00,Bac +2,Au moins 1 an,Nouméa,Anonyme,,"Établir, mettre à jour un dossier, une base de données,Utiliser les outils bureautiques,Effectuer le suivi des commandes, la facturation,Assurer un accueil téléphonique,Transmettre de l'information,Acceuillir, orienter, informer une personne",,cyril.jay@inter-invest.fr
K2104,2026-03-02,Assistant / Assistante d'éducation,2026-02-25 12:21:13+00,"",,9 mois,1,2026-02-024450,2026-02-25 11:53:39+00,"Bac, bac professionnel",Au moins 3 ans,Poindimié,CLG P. DE POINDIMIE,98822 POINDIMIE,"Conseiller, accompagner une personne,Utiliser les outils bureautiques,Travailler en réseau,Enseigner, transmettre des connaissances, développer des compétences","Relation à l'enfant ou l'adolescent,Règlement intérieur, consignes de sécurité, règles de vie collective",ce.9830008s@ac-noumea.nc
C1107,2026-03-16,Chargé / Chargée d'indemnisations en assurances,2026-02-23 12:36:56+00,"",,3 mois,2,2026-02-024413,2026-02-23 12:36:56+00,Bac +2,Moins d'1 an,Nouméa,G.A.A.,98800 Nouméa,"Vérifier les garanties souscrites dans le cas d'un sinistre,Établir, mettre à jour un dossier, une base de données,Analyser l'origine, la cause et les circonstances d'un sinistre,Déployer les procédures d'indemnisation des assurés, victimes,Mandater des experts pour l'évaluation des dommages et pertes,Structurer, synthétiser des informations",,contactgaanc@gmail.com
M1204,2026-03-05,Contrôleur / Contrôleuse de gestion financière,2026-03-05 18:16:46+00,Dès que possible,,,1,2026-03-024543,2026-03-05 18:16:46+00,"Bac + 3, bac + 4",Au moins 5 ans,Nouméa,ABI SHARP CENTER,98802 NOUMEA CEDEX,"Mettre en place des solutions d'amélioration de la performance,Conseiller une organisation, une structure,Suivre le système d'informations de gestion,Diriger et gérer un ensemble, une structure, une organisation,Contrôler des indicateurs de performance, analyser et corriger des écarts,Rédiger un rapport, un compte rendu d'activité,Calculer les marges, la rentabilité d'un produit ou d'une activité,Mettre en place des outils d'aide à la décision,Proposer et accompagner des actions de transformation organisationnelle,Élaborer des tableaux de bord,Assurer la gestion administrative d'une activité,Animer, coordonner une équipe,Déterminer des mesures correctives,Superviser le contrôle interne d'une structure,Concevoir un plan prévisionnel d'activité,Piloter la gestion de la production, de l'exploitation","Gestion de l'information,Étude prospective,Droit des sociétés,Indicateurs de suivi d'activité",c.tourdot@sharp-center.nc
J1506,2026-02-18,Infirmier préleveur / Infirmière préleveuse,2026-02-18 15:06:50+00,Dès que possible,Diplôme d'Etat Infirmier,3 mois,1,2026-02-024369,2026-02-18 15:06:50+00,"Bac + 3, bac + 4",Au moins 3 ans,Nouméa,CALEDOBIO,98845 NOUMEA CEDEX,"Pratiquer des prélèvements sanguins et bactériologiques,Renseigner des documents médico-administratifs,Informer un patient,Désinfecter et décontaminer un équipement,Cerner l'état du patient (clinique, psychologique) et consigner les informations recueillies dans le dossier médical,Tenir à jour les dossiers médico-administratifs des patients","Hygiène hospitalière,Démarche de Soins Infirmiers (DSI),Charte des droits du patient",recrutement@caledobio.nc
C1102,2026-03-09,"Conseiller / Conseillère Incendie, Accidents, Risques Divers -IARD-",2026-03-09 09:10:56+00,Dès que possible,Certification Assurance IARD Prévoyance,,1,2026-03-024561,2026-03-09 09:10:56+00,"Bac, bac professionnel",Au moins 3 ans,Nouméa,IFP PATRIMOINE,98807 NOUMEA CEDEX,"Enregistrer et traiter les réclamations des clients et bénéficiaires,Développer et fidéliser la relation client,Établir, mettre à jour un dossier, une base de données,Recueillir et analyser les besoins client,Déclencher des appels à cotisation,Rédiger un contrat d'assurance,Procéder à l'encaissement,Structurer, synthétiser des informations,Présenter et valoriser un produit ou un service,Développer un portefeuille clients et prospects",,brouveyrol@ifp.nc
F1201,2026-03-01,Conducteur / Conductrice de travaux du BTP,2026-03-09 11:29:47+00,Dès que possible,,,1,2026-03-024565,2026-03-09 11:29:47+00,Bac + 5 et plus,Au moins 5 ans,Dumbéa,Anonyme,,"Établir, mettre à jour un dossier, une base de données,Effectuer le suivi des commandes, la facturation,Préparer l'intervention et installer le chantier,Utiliser les outils bureautiques,Communiquer auprès de ses clients internes et externes,Suivre un contrat, vérifier le respect des clauses contractuelles,Commander les matériaux et matériels,Détecter des besoins d'intervention supplémentaire avec le maître d'ouvrage,Établir un rapport de chantier,Réceptionner un ouvrage,Planifier des opérations de chantier,Organiser des réunions et des visites de chantier,Apporter un appui technique aux équipes de chantier,Superviser la gestion des stocks,Coordonner des travaux d'aménagement paysager, de végétalisation de toitures et terrasses,Implanter des éléments de sécurité ou de signalisation,Présenter un dossier de chantier au chef de chantier et aux intervenants,Travailler en réseau,Gérer les ressources humaines,Animer, coordonner une équipe",,recrutement.a16@gmail.com
G1501,2026-03-09,Valet / Femme de chambre,2026-03-09 11:31:59+00,Dès que possible,,1 mois,1,2026-03-024566,2026-03-09 11:31:59+00,"CAP, BEP",Moins d'1 an,Nouméa,ABC DU PROPRE,98800 Nouméa,"Identifier et signaler les dysfonctionnements, les dégradations du mobilier et des équipements de la chambre,Informer, renseigner, orienter une personne sur les prestations et services proposés,Communiquer à l'oral en milieu professionnel,Approvisionner un chariot de ménage/chariot de linge,Désinfecter et décontaminer un équipement,Doser des produits d'entretien,Entretenir, nettoyer un espace, un lieu, un local,Changer les draps, refaire le lit (mise à blanc, recouche) et remplacer le linge de toilette",,gerance.abc.dupropre@gmail.com
D1211,2026-02-18,Vendeur / Vendeuse en cadeaux souvenirs,2026-02-18 15:34:47+00,Dès que possible,,3 mois,1,2026-02-024373,2026-02-18 15:34:47+00,,Au moins 1 an,Nouméa,LASER ART PACIFIC,98800 Nouméa,"Communiquer à l'oral en langue étrangère,Informer, renseigner une personne sur les articles en vente,Développer et fidéliser la relation client,Vendre ou louer des produits ou des services,Utiliser les outils bureautiques,Réaliser un inventaire,Procéder à l'encaissement,Ranger des produits ou marchandises selon leurs dates de validité et les conditions de conservation,Réaliser la mise en rayon,Contrôler l'état des stocks,Réaliser l'étiquetage de produits,Gérer une caisse,Définir des besoins en approvisionnement,Organiser le traitement des commandes,Présenter et valoriser un produit ou un service,Vendre des articles de sports et de loisirs,Répondre aux attentes d'un client,Acceuillir, orienter, informer une personne,Réceptionner des produits, des matières premières, vérifier la conformité d'une livraison",,recrutement@lap.nc
F1613,2026-03-02,Calorifugeur / Calorifugeuse,2026-03-02 10:27:25+00,Dès que possible,,3 mois,1,2026-03-024501,2026-03-02 10:27:25+00,"Bac, bac professionnel",Au moins 10 ans,Nouméa,Easy Skill,98800 NOUMEA,"Anticiper des dangers, problèmes ou besoins matériels et techniques,Réaliser la préparation des supports,Implanter une zone de chantier,Réaliser un chevêtre pour un châssis,Vérifier l'évacuation des eaux de pluie,Poser des revêtements en asphalte,Sécuriser le périmètre d'intervention,Vérifier l'étanchéité d'un revêtement,Acheminer les matériaux et matériels jusqu'au chantier,Réaliser une veille technique ou technologique pour anticiper les évolutions,Réaliser des rigoles en zinc ou en plomb,Poser une toiture sèche en respectant le calepinage pour recouvrir l'étanchéité,Installer des isolations thermiques ou anti feu,Installer des isolations phoniques,Animer, coordonner une équipe,Manipuler un engin de manutention ou de chantier,Répondre aux attentes d'un client,Transmettre une technique, un savoir-faire,Rédiger un rapport, un compte rendu d'activité,Poser une surface en béton,Nettoyer le site d'intervention et ranger les outils,Fixer des éléments de bardages métalliques,Fixer des panneaux étanches et isolants,Évaluer la faisabilité de l'opération d'un point de vue technique,Ordonnancer l'ensemble des tâches en concertation avec les différents intervenants,Réaliser un bilan thermique simplifié avec les outils agréés,Démolir une construction,Réserver des ouvertures et éléments d'ouvrage prévus (exutoire de désenfumage, aération, ...),Sécher les surfaces,Déposer un revêtement,Monter ou démonter un échafaudage,Alerter, en qualifiant la nature du problème,Évaluer une situation à risque,Utiliser une installation, une machine","Utilisation d'équipements mécanisés,Règles et consignes de sécurité,Techniques de calorifugeage,Types d'isolation thermique,Caractéristiques des matériaux isolants,Procédés d'étanchéité,Utilisation de matériel de nettoyage,Lecture de plan, de schéma",remy.devedeux@easy-skill.com
H1303,2026-03-02,"Technicien / Technicienne en Hygiène, Sécurité, Environnement industriel -HSE-",2026-03-02 11:58:47+00,Dès que possible,,,1,2026-03-024502,2026-03-02 11:58:47+00,Bac +2,Au moins 5 ans,Nouméa,ÂBORO CONSULTING,98845 NOUMEA CEDEX,"Contrôler la réalisation et les coûts d¿une prestation,Intégrer l'éco-responsabilité dans toutes les dimensions de son activité,Contrôler des indicateurs de performance, analyser et corriger des écarts,Utiliser les outils bureautiques,Expliquer et faire respecter les règles et procédures,Rédiger un rapport, un compte rendu d'activité,Définir des mesures de prévention des risques,Établir un rapport d'accident et d'incident,Réaliser des relevés, mesures, prélèvements, identifier des écarts (taux, seuil, ...) et préconiser des mesures correctives,Entretenir un équipement de contrôle ou de mesure,Contrôler la validité de qualification des moyens et des personnes (habilitation, autorisation, agrément),Mesurer l'efficacité du plan d'action,Apporter un appui technique aux services qualité, maintenance, méthodes,Analyser un dysfonctionnement ou une non-conformité,Participer à l'innovation et contribuer à l'amélioration continue du travail,Formuler des propositions d'amélioration des process, des conditions de travail et de la santé et sécurité au travail,Participer à un travail collaboratif,Analyser et prévenir les risques,Contrôler les règles de Qualité, Hygiène, Sécurité, Santé et Environnement (QHSSE),Former aux évolutions techniques et règlementaires",,rachelle.sekeme@aboro.nc
M1609,2025-12-08,Secrétaire médical / médicale,2026-02-24 12:50:34+00,"",,,1,2026-02-024437,2026-02-24 12:50:34+00,"Bac, bac professionnel",Au moins 1 an,Nouméa,SCM APEX,98800 Nouméa,"Conseiller, accompagner une personne,Réaliser une veille documentaire,Procéder à l'encaissement,Actualiser le dossier médical du patient,Coordonner l'activité d'une équipe,Renseigner des documents médico-administratifs,Assurer un accueil téléphonique,Contrôler l'état des stocks,Identifier la demande du patient et rechercher les informations complémentaires dans le dossier médical,Assurer la gestion administrative d'une activité,Organiser le traitement des commandes,Accueillir, orienter et renseigner un patient,Transmettre de l'information,Procéder à l'enregistrement, au tri, à l'affranchissement du courrier","Méthode de classement et d'archivage,Nomenclature des actes médicaux,Mode de prise en charge des actes médicaux,Modalités d'accueil",cabinetdentairemedisud@gmail.com
C1203,2026-02-26,Chargé / Chargée d'affaires bancaires professionnelles,2026-02-26 14:20:01+00,Dès que possible,,,1,2026-02-024476,2026-02-26 14:20:01+00,Bac +2,Au moins 1 an,Nouméa,INTER INVEST OUTRE MER,98801 NOUMEA CEDEX,"Analyser et gérer les risques financiers,Développer et fidéliser la relation client,Monter un dossier de financement,Recueillir et analyser les besoins client,Élaborer, adapter une proposition commerciale,Respecter des règles, des consignes, normes et procédures opérationnelles,Structurer, synthétiser des informations,Respecter la confidentialité des informations,Développer un portefeuille clients et prospects",,cyril.jay@inter-invest.fr
