coderome,a_pourvoir_le,titre_offre,date_publication,des_que_possible_desc,diplome,duree_contrat,nb_postes,numero,created,niveau_formation,experience,commune_emploi,employeur_nom_entreprise,employeur_adresse_correspondance_subdivision,activites_multivalue,competences_multivalue,contact_mail
M1707,2026-02-24,Responsable commercial / commerciale,2026-02-24 11:17:55+00,Dès que possible,Commerce et marketing,,1,2026-02-024433,2026-02-24 11:17:55+00,"Bac + 3, bac + 4",Au moins 5 ans,Nouméa,INTERMEDIAS,98857,"Préparer et animer une réunion, un groupe de travail, un atelier,Animer, coordonner une équipe",,y.milin@voixducaillou.nc
E1103,2026-03-09,Chargé / Chargée des relations publiques digitales,2026-03-09 09:09:09+00,Dès que possible,Marketing digital / Communication,,1,2026-03-024556,2026-03-09 09:09:09+00,"Bac + 3, bac + 4",Au moins 3 ans,Nouméa,IFP PATRIMOINE,98807 NOUMEA CEDEX,"Diriger et gérer un ensemble, une structure, une organisation,Organiser, coordonner un événement,Maîtriser la e-réputation d'une entreprise,Administrer un site web,Concevoir des supports de communication visuelle,Améliorer le positionnement d'un site web,Mettre en oeuvre des actions de communication,Mettre en oeuvre des actions de communication interne,Mener une campagne d'e-mailing,Définir une stratégie de communication,Concevoir un support de communication audiovisuel,Rédiger le contenu d'un support de communication",,brouveyrol@ifp.nc
C1205,2026-03-09,Conseiller / Conseillère en gestion de patrimoine financier,2026-03-09 09:09:42+00,Dès que possible,"finance, gestion ou école de commerce",,2,2026-03-024558,2026-03-09 09:09:42+00,Bac + 5 et plus,Au moins 3 ans,Nouméa,IFP PATRIMOINE,98807 NOUMEA CEDEX,"Établir le bilan patrimonial d'un client,Développer et fidéliser la relation client,Établir, mettre à jour un dossier, une base de données,Rédiger des rapports d'activité,Gérer un patrimoine, un portefeuille d'actifs,Analyser la situation financière d'un client,Déterminer des mesures correctives,Respecter la confidentialité des informations,Développer un portefeuille clients et prospects",,brouveyrol@ifp.nc
C1205,2026-03-09,Conseiller / Conseillère en gestion de fortune,2026-03-09 09:10:07+00,Dès que possible,Master en GP,,1,2026-03-024559,2026-03-09 09:10:07+00,Bac + 5 et plus,Au moins 5 ans,Nouméa,IFP PATRIMOINE,98807 NOUMEA CEDEX,"Établir le bilan patrimonial d'un client,Proposer une stratégie d'investissement,Développer et fidéliser la relation client,Établir, mettre à jour un dossier, une base de données,Recueillir et analyser les besoins client,Rédiger des rapports d'activité,Gérer un patrimoine, un portefeuille d'actifs,Concevoir des montages financiers complexes,Analyser la situation financière d'un client,Orienter un client vers un avocat, un notaire ou un gérant de portefeuille,Respecter la confidentialité des informations,Développer un portefeuille clients et prospects",,brouveyrol@ifp.nc
C1103,2026-03-09,Courtier / Courtière en assurances,2026-03-09 09:10:31+00,Dès que possible,"finance, gestion ou école de commerce",,1,2026-03-024560,2026-03-09 09:10:31+00,"Bac + 3, bac + 4",Au moins 5 ans,Nouméa,IFP PATRIMOINE,98807 NOUMEA CEDEX,"Conseiller dans le cadre d'une relation commerciale,Réaliser des opérations de marché financier,Développer et fidéliser la relation client,Diriger et gérer un ensemble, une structure, une organisation,Établir, mettre à jour un dossier, une base de données,Actualiser un contrat,Réaliser un suivi financier,Gérer un réseau d'apporteurs d'affaires,Présenter les clauses d'un contrat,Réaliser le suivi des dossiers clients et prospects,Établir un devis,Concevoir une proposition de contrat,Coordonner la gestion de sinistres,Animer, coordonner une équipe,Contrôler la conformité des données ou des documents,Prévenir et résoudre les conflits,Développer un réseau d'apporteurs d'affaires,Développer un portefeuille clients et prospects",,brouveyrol@ifp.nc
J1102,2026-03-01,Ophtalmologue,2026-02-24 11:12:57+00,"",Certificat études ophtalmologie,3 mois,1,2026-02-024431,2026-02-24 11:12:57+00,Bac + 5 et plus,Au moins 1 an,Nouméa,MUTUELLE DU NICKEL,98845 Nouméa cédex,"Réaliser la prescription médicale, expliquer les modalités de traitement au patient et le conseiller sur l'hygiène de vie,Déterminer les besoins thérapeutiques et réaliser les soins médicaux,Pratiquer des expertises médicales,Recenser les symptômes, les dysfonctionnements, cerner l'environnement de vie du patient et procéder à l'examen clinique,Actualiser le dossier médical du patient",Ophtalmologie,rh@mdn.nc
D1402,2026-02-20,Commercial / Commerciale auprès d'une clientèle d'entreprises,2026-02-20 09:31:03+00,Dès que possible,,,1,2026-02-024392,2026-02-20 09:31:03+00,Bac +2,Au moins 3 ans,Nouméa,Anonyme,,"Développer et fidéliser la relation client,Établir un plan de tournée de prospection (ciblage, interlocuteurs, préparation de dossiers techniques),Mettre en oeuvre des actions commerciales et promotionnelles,Conseiller, accompagner une personne,Élaborer, adapter une proposition commerciale,Utiliser les outils bureautiques,Négocier des conditions commerciales,Prospecter de nouveaux clients, de nouveaux marchés","Logiciel de gestion clients,Gestion administrative d'une prospection,Prospection commerciale,Méthodes de plan de prospection",cyril.jay@inter-invest.fr
G1204,2026-02-27,Moniteur / Monitrice de voile,2026-03-02 07:05:26+00,Dès que possible,Moniteur fédéral de voile,3 mois,1,2026-02-024482,2026-02-27 09:53:22+00,"Bac, bac professionnel",Moins d'1 an,Lifou,Centre d'Animation Nautique Hnaipolë Lifou,98820 LIFOU,"Développer et fidéliser la relation client,Analyser les vidéos de sport pour déterminer les objectifs sportifs,Concevoir et mettre en place un programme de préparation physique,Sélectionner le matériel ou les équipements selon la compétition et les contraintes,Identifier les attentes du client et l'informer sur la ou les activités possibles selon son niveau et les modalités d'organisation,Informer le public sur la pratique de la discipline sportive et les modalités d'organisation des séances,Adapter un parcours ou une séquence pédagogique selon le niveau et la progression des apprenants,Coacher des particuliers,Évaluer le niveau de départ du pratiquant,Contribuer à des actions de promotion dans les médias et sur les réseaux sociaux,Réaliser le suivi du matériel ou des équipements sportifs,Présenter l'exercice aux pratiquants et apporter un appui technique,Expliquer les conditions de pratique d'une activité sportive,Animer, coordonner une équipe,Enseigner, transmettre des connaissances, développer des compétences,Développer l'image et la notoriété d'une entreprise,Acceuillir, orienter, informer une personne,Concevoir et animer des activités sportives",,lifouvoilecanhl@gmail.com
C1106,2026-04-01,Expert / Experte en assurances dommages,2026-03-02 07:05:44+00,"",Licence Contrôle et Expertise bâtiment,,1,2026-02-024488,2026-02-28 02:47:14+00,"Bac + 3, bac + 4",Au moins 5 ans,Nouméa,Anonyme,,"Rechercher les causes/origines d'accidents ou de sinistres par des enquêtes sur le terrain, auprès des parties concernées","Logiciel de gestion clients,Assurances,Analyse des risques,Produit d'assurances dommages/sinistres,Risques incendie,Gestion de sinistre,Risques naturels",melanie.mesmin@elex.fr
I1304,2026-02-18,Électromécanicien / Électromécanicienne de maintenance industrielle,2026-02-18 15:26:19+00,Dès que possible,Electrotechnique,,1,2026-02-024372,2026-02-18 15:26:19+00,"CAP, BEP",Au moins 10 ans,Poya,STE LE NICKEL - SLN,98800 NOUMEA,"Contrôler la qualité et la conformité des process,Contrôler la qualité et la conformité d'un produit,Monter et régler une installation, une machine,Accompagner l'appropriation d'un outil par ses utilisateurs,Contribuer à la cybersécurité de l'entreprise : savoir reconnaître les données sensibles,Réaliser un premier diagnostic de dysfonctionnement et appliquer les mesures correctives,Anticiper les risques de cybersécurité,Utiliser des appareils de tests (pression, débit, vibration, ...) et de mesure électrique,Détecter l'origine d'une panne (sur place ou à distance),Apporter une assistance technique,Réparer un équipement, une machine, une installation,Analyser, exploiter, structurer des données,Réaliser un diagnostic technique,Transmettre une technique, un savoir-faire,Réaliser un diagnostic de fonctionnement et contrôler les machines, installations et équipements,Utiliser des logiciels spécifiques,Estimer les coûts et les délais d'une activité ou d'une prestation,Participer à l'innovation et contribuer à l'amélioration continue du travail,Analyser des données de maintenance,Participer à un travail collaboratif,Alerter, en qualifiant la nature du problème,Suivre une opération de maintenance, de support technique,Utiliser une installation, une machine,Établir, mettre à jour un dossier, une base de données,Organiser et planifier une activité,Réaliser des opérations de maintenance à caractère préventif, systématique ou conditionnel,Organiser et programmer les activités et opérations de maintenance,Superviser une opération de maintenance,Lire et exploiter un plan, un schéma,Proposer des solutions pour optimiser sécurité et performance des matériels,Détecter les dysfonctionnements des installations, déterminer les causes de panne et établir les demandes d'intervention de maintenance,Animer, coordonner une équipe,Déterminer des mesures correctives,Réaliser les réglages de mise au point de l'équipement industriel ou d'exploitation et contrôler son fonctionnement,Valoriser et partager les bonnes pratiques,Renseigner, mettre à jour une documentation technique,Élaborer des règles et procédures de Qualité, Hygiène, Sécurité, Santé et Environnement (QHSSE),Comprendre, interpréter des données et documents techniques,Respecter des règles, des consignes, normes et procédures opérationnelles,Expliquer et faire respecter les règles et procédures,Mobiliser des données massives pour éclairer les prises de décisions,Rédiger un rapport, un compte rendu d'activité,Réaliser le montage d'équipements industriels ou d'exploitation,Planifier une opération de maintenance,Contrôler, surveiller et entretenir régulièrement les équipements,Utiliser un outil, une machine, un équipement,Contrôler le fonctionnement d'un équipement, d'une machine, d'une installation,Transmettre de l'information,Collecter et analyser des informations,Identifier les composants et les pièces défectueuses","Métrologie,Gestion de Maintenance Assistée par Ordinateur (GMAO),Lecture de plan, de schéma,Électricité,Utilisation d'appareil de tests (pressions, débit, vibrations, ...),Données de maintenance,Lecture de dessins techniques,Chariots frontaux en porte-à-faux (capacité nominale > 6 tonnes) (CACES R 489-4) - Depuis le 01/01/2020,Habilitations électriques de travaux hors tension,Chariots frontaux en porte-à-faux (capacité nominale < ou = à 6 tonnes) (CACES R 489-3) - Depuis le 01/01/2020,Habilitations électriques de travaux sous tension,Électronique,Techniques de soudure,Hydraulique,Utilisation d'appareils de mesure électrique (multimètre, ...),Techniques et procédés d'assemblage,Électromécanique,Mécanique,Pneumatique,Règles de sécurité",aurore.lejeune@eramet-sln.com
M1403,2026-02-25,Analyste en intelligence économique,2026-02-25 14:23:29+00,Dès que possible,,,1,2026-02-024453,2026-02-25 14:23:29+00,Bac + 5 et plus,Au moins 1 an,Nouméa,AGENCE INSTITUT D'EMISSION NOUMEA,98845 NOUMEA CEDEX,"Établir des prévisions, des évaluations, des recommandations, des perspectives,Assister une structure dans l'interprétation et l'analyse d'une étude,Utiliser les outils bureautiques,Réaliser une veille documentaire,Définir et faire évoluer des procédés de traitement de l'information,Réaliser une étude,Réaliser des études spécifiques,Adapter les outils de traitement statistique de données,Analyser, exploiter, structurer des données,Rédiger l'information produite,Présenter et diffuser les résultats des études réalisées,Réaliser un modèle de prévision",,IEOM-NC-RessourcesHumaines@ieom.nc
D1404,2026-02-20,Conseiller commercial / Conseillère commerciale en véhicules industriels,2026-02-20 07:35:52+00,Dès que possible,commerce,,1,2026-02-024389,2026-02-20 07:35:52+00,Bac +2,Au moins 3 ans,Nouméa,SUPERCAL EQUIPEMENT,98845 NOUMEA CEDEX,"Assurer un service après-vente,Vendre ou louer des produits ou des services,Mettre en oeuvre des actions commerciales et promotionnelles,Recueillir et analyser les besoins client,Élaborer, adapter une proposition commerciale,Effectuer le suivi des commandes, la facturation,Contrôler le montage des dossiers-clients de financement,Rédiger un rapport, un compte rendu d'activité,Assister un client lors de la prise en main d'un véhicule/matériel,Proposer des solutions techniques à un client,Monter un dossier de crédit,Négocier des conditions commerciales,Estimer la valeur d'un bien, d'un produit,Présenter et valoriser un produit ou un service","Entretien de vente,Techniques de prospection (phoning, visites),Véhicules utilitaires,Techniques de vente,Typologie du client,Techniques commerciales,Caractéristiques des véhicules industriels,Techniques d'écoute active,Droit commercial",n.gregoire@hgj.nc
M1101,2026-03-02,Acheteur industriel / Acheteuse industrielle,2026-02-17 12:55:11+00,"",Commerce / Supply Chain,,1,2026-02-024345,2026-02-17 12:55:11+00,Bac + 5 et plus,Au moins 5 ans,Nouméa,Easy Skill,98800 NOUMEA,"Mettre en place des solutions d'amélioration de la performance,Établir, mettre à jour un dossier, une base de données,Utiliser les outils bureautiques,Élaborer une stratégie d'achat, optimiser la procédure d'achat,Lancer et gérer un appel d'offres,Identifier et sélectionner des fournisseurs, sous-traitants, prestataires,Suivre un contrat, vérifier le respect des clauses contractuelles,Rédiger un rapport, un compte rendu d'activité,Analyser une réponse à un appel d'offres,Traiter des dossiers de contentieux,Définir des besoins en approvisionnement,Évaluer des fournisseurs, sous-traitants, prestataires,Négocier des conditions commerciales,Contrôler la conformité des données ou des documents,Rédiger un cahier des charges, des spécifications techniques,Négocier un contrat,Actualiser des données d'activité","Argumentation commerciale,Procédures d'appels d'offres,Organisation de la chaîne logistique",remy.devedeux@easy-skill.com
D1507,2026-03-03,Employé polyvalent / Employée polyvalente de libre-service,2026-03-03 09:07:59+00,Dès que possible,,1 mois,1,2026-03-024508,2026-03-03 09:07:59+00,,Au moins 1 an,Nouméa,GE2B,98860 KONE,"Informer, renseigner une personne sur les articles en vente,Réaliser l'étiquetage de produits,Retirer des produits non conformes,Réaliser un inventaire,Procéder à l'encaissement,Définir des besoins en approvisionnement,Entretenir, nettoyer un espace, un lieu, un local,Contrôler l'état des stocks,Contrôler le balisage et l'étiquetage des produits en rayon,Présenter et valoriser un produit ou un service,Organiser, aménager un espace de vente,Réceptionner des produits, des matières premières, vérifier la conformité d'une livraison","Utilisation d'engins de manutention non motorisés (transpalette, diable, ...),Techniques de vente,Utilisation d'appareils de lecture optique de codes-barres (pistolet, flasheur, ...),Procédures d'encaissement,Règles d'hygiène et de sécurité,Gestes et postures de manutention,Techniques de mise en rayon,Logiciel de gestion de stocks",cvgevkpp@gmail.com
J1506,2026-02-17,Infirmier / Infirmière en gériatrie,2026-02-17 14:39:14+00,Dès que possible,DIPLOME IDE,,2,2026-02-024347,2026-02-17 14:39:14+00,"Bac + 3, bac + 4",Au moins 3 ans,Dumbéa,Anonyme,,"Pratiquer des soins palliatifs,Réaliser des soins d'hygiène corporelle, de confort et de prévention,Réaliser un prélèvement biologique,Réaliser ou contrôler les soins d'hygiène, de confort et apporter une aide au patient (lever, marche, soins post opératoires...),Tenir à jour les dossiers médico-administratifs des patients,Informer un patient,Désinfecter et décontaminer un équipement,Assurer la gestion administrative d'une activité,Cerner l'état du patient (clinique, psychologique) et consigner les informations recueillies dans le dossier médical,Pratiquer des prises en charge de la douleur,Surveiller l'état de santé d'une personne,Surveiller l'état clinique du patient (constantes, fonctions d'élimination, comportement, ...) et informer l'équipe soignante/médicale sur l'évolution de l'état clinique,Réaliser les soins infirmiers, communiquer avec le patient (ressenti, douleur, ...) et actualiser le dossier de soins infirmiers (incidents, modifications d'état clinique, ...),Analyser des résultats d'examen médicaux,Organiser le plan de soins infirmiers selon les besoins des patients et préparer le chariot de soins ou la trousse médicale,Réaliser des soins infirmiers","Charte des droits du patient,Psychologie,Règles d'hygiène et d'asepsie",directioncordyline@gmail.com
G1203,2026-02-24,Accompagnateur / Accompagnatrice d'enfants ou d'adolescents,2026-02-24 09:18:20+00,Dès que possible,,,5,2026-02-024425,2026-02-24 09:18:20+00,"CAP, BEP",Moins d'1 an,Nouméa,Association AVA,98805 NOUMEA CEDEX,"Observer le comportement, l'évolution de l'enfant et repérer d'éventuelles difficultés,Expliquer et faire respecter les règles et procédures,Accompagner l'enfant dans l'apprentissage des gestes de la vie quotidienne et des règles de vie en collectivité,Acceuillir, orienter, informer une personne","Règles d'hygiène et de sécurité,Gestes d'urgence et de secours",assoava@assoava.nc
N3101,2026-02-20,Lieutenant / Lieutenante chef de quart,2026-02-20 08:31:59+00,Dès que possible,,,1,2026-02-024390,2026-02-20 08:31:59+00,"Bac + 3, bac + 4",Moins d'1 an,Nouméa,Anonyme,,"Coordonner la conduite du navire durant la traversée et mettre en place les mesures correctives,Recueillir les données techniques de la traversée (horaires, distances, météo, ...) et élaborer la feuille de route,Respecter les règles de Qualité, Hygiène, Sécurité, Santé et Environnement (QHSSE),Planifier une opération de maintenance,Décharger des marchandises, des produits,Consigner les éléments d'activité (dysfonctionnement, infraction, incident) sur les supports techniques,Charger des marchandises, des produits,Contrôler le fonctionnement d'un équipement de sécurité,Superviser une opération de maintenance,Gérer les stocks,Contrôler les systèmes de sécurité,Coordonner l'activité d'une équipe,Animer, coordonner une équipe,Transmettre de l'information,Planifier l'activité d'une structure","Techniques de planification,Réglementation du transport de marchandises,Logiciel professionnel de transport maritime,Réglementation portuaire,Utilisation de matériel de navigation,Management,Règles de sécurité à bord des navires (personnes et marchandises),Utilisation d'outils de contrôle de maintenance (capteur, détecteur, ...),Droit maritime",recrutement@betico.nc
H2504,2026-02-24,Chef d'équipe de fabrication en industrie alimentaire,2026-02-24 09:28:03+00,Dès que possible,,6 mois,1,2026-02-024426,2026-02-24 09:28:03+00,"Bac, bac professionnel",Moins d'1 an,Pouembout,Anonyme,,"Contrôler la qualité et la conformité d'un produit,Observer des faits, des évènements, des comportements,Communiquer à l'oral en milieu professionnel,Contrôler les expéditions de commandes,Établir l'état d'avancement de travaux,Contrôler la conformité d'un équipement, d'une machine, d'une installation,Concevoir des procédures de maintenance,Réaliser une opération de maintenance,Gérer les stocks,Organiser et contrôler un approvisionnement,Entretenir un équipement, une machine, une installation,Enseigner, transmettre des connaissances, développer des compétences,Rendre compte de son activité,Animer, coordonner une équipe,Déterminer des mesures correctives,Définir des besoins en développement des compétences,Analyser, exploiter, structurer des données,Prévenir et résoudre les conflits,Contrôler les règles de Qualité, Hygiène, Sécurité, Santé et Environnement (QHSSE),Réaliser un diagnostic technique,Mettre en oeuvre des actions d'amélioration,Transmettre une technique, un savoir-faire,Planifier des interventions de maintenance,Renseigner, mettre à jour une documentation technique,Évaluer et développer les compétences de ses collaborateurs,Créer une documentation technique,Élaborer des processus et des modes opératoires techniques,Comprendre, interpréter des données et documents techniques,Piloter une démarche qualité, un processus d'amélioration continue,Contrôler des indicateurs de performance, analyser et corriger des écarts,Piloter une activité,Utiliser les outils bureautiques,Expliquer et faire respecter les règles et procédures,Préparer et animer une réunion, un groupe de travail, un atelier,Rédiger un rapport, un compte rendu d'activité,Utiliser des logiciels spécifiques,Établir des éléments d'une commande,Apporter un appui technique aux services qualité, maintenance, méthodes,Identifier les anomalies ou les dysfonctionnements d'une production,Réduire l'empreinte environnementale de son activité,Contrôler le fonctionnement d'un équipement, d'une machine, d'une installation,Alerter, en qualifiant la nature du problème,Préparer du matériel en prévision d'un travail,Réaliser des échantillons tests,Élaborer et planifier un programme de production, d'exploitation,Piloter la gestion de la production, de l'exploitation","Modalités de stockage,Méthodes de Gestion des Moyens de Production,Normes qualité,Règles d'hygiène et de salubrité,Bonnes Pratiques de Fabrication -BPF-,Procédures de contrôle mécanique,Modalités d'approvisionnement d'une ligne de production,Logiciel de gestion de stocks,Méthodes et outils de résolution de problèmes,Système Hazard Analysis Critical Control Point (HACCP),Procédures de dépollution,Législation sociale,Normes environnementales,Règles de sécurité",direction@pacificflavours.com
M1607,2026-03-15,Secrétaire juridique,2026-03-03 13:11:14+00,"",DIPLOMEJURIDIQUE,6 mois,1,2026-03-024513,2026-03-03 11:53:01+00,"Bac + 3, bac + 4",Au moins 1 an,Koné,Daniel RODRIGUEZ Avocat,98825 POUEMBOUT,"Renseigner, mettre à jour une documentation technique,Établir, mettre à jour un dossier, une base de données,Utiliser les outils bureautiques,Assurer la gestion administrative d'une activité,Classer des documents,Planifier des rendez-vous,Acceuillir, orienter, informer une personne,Archiver des dossiers et documents de référence,Saisir des documents juridiques","Gestion administrative du courrier,Modalités d'accueil,Normes rédactionnelles",contact.avocatrodriguez@gmail.com
M1802,2026-02-17,Expert / Experte en sécurité des systèmes d'exploitation,2026-02-17 16:13:52+00,Dès que possible,Informatique ou Technique,,1,2026-02-024353,2026-02-17 16:13:52+00,Bac +2,Au moins 5 ans,Dumbéa,CSB,98845 NOUMEA CEDEX,"Concevoir et gérer un projet,Créer une documentation technique,Élaborer des actions ou des règles de prévention,Recueillir et analyser les besoins client,Piloter une activité,Accompagner l'appropriation d'un outil par ses utilisateurs,Expliquer et faire respecter les règles et procédures,Gérer des données massives,Évaluer, prévenir, et gérer les risques et la sécurité,Communiquer auprès de ses clients internes et externes,Structurer, synthétiser des informations,Identifier les besoins en logiciel,Veiller au respect de la loi Informatique et Libertés et du RGPD dans l'entreprise, gérer la liste des traitements de données à caractère personnel, faire l'interface avec la Commission Nationale de l'Informatique et des Libertés - CNIL,Réaliser une veille technique ou technologique pour anticiper les évolutions,Apporter une assistance technique,Évaluer le résultat de ses actions,Contrôler la conformité des données ou des documents","Systèmes d'exploitation informatique,Gestion des risques (Risk Management),Conduite d'opérations de gestion de crise,Procédures de tests,Domaine informatique client-serveur,Règles de sécurité Informatique et Télécoms,Informatique de gestion,Méthodes d'analyse (systémique, fonctionnelle, de risques, ...),Normes et standards d'exploitation,Réseaux informatiques et télécoms,Analyse d'incidents",recrutement@csb.nc
C1205,2026-03-03,Conseiller / Conseillère en investissements financiers,2026-03-04 01:35:17+00,Dès que possible,,,1,2026-03-024517,2026-03-04 01:35:17+00,Bac + 5 et plus,Au moins 5 ans,Nouméa,CFM Indosuez Conseil en Investissement,98800 NOUMEA,"Proposer une stratégie d'investissement,Développer et fidéliser la relation client,Établir, mettre à jour un dossier, une base de données,Recueillir et analyser les besoins client,Rédiger des rapports d'activité,Gérer un patrimoine, un portefeuille d'actifs,Concevoir des montages financiers complexes,Analyser la situation financière d'un client,Adapter une campagne promotionnelle à une cible ou un produit,Respecter la confidentialité des informations,Définir une stratégie de gestion du patrimoine immobilier,Développer un portefeuille clients et prospects","Réglementation bancaire,Caractéristiques des produits financiers,Analyse des risques financiers,Économie des marchés financiers",xgluszyk@cfm-indosuez.mc
