coderome,a_pourvoir_le,titre_offre,date_publication,des_que_possible_desc,diplome,duree_contrat,nb_postes,numero,created,niveau_formation,experience,commune_emploi,employeur_nom_entreprise,employeur_adresse_correspondance_subdivision,activites_multivalue,competences_multivalue,contact_mail
M1805,2025-08-27,Développeur / Développeuse full-stack,2025-08-27 17:46:36+00,Dès que possible,,,1,2025-08-022889,2025-08-27 17:46:36+00,"Bac + 3, bac + 4",Au moins 1 an,Nouméa,AGILESOFT.NC,98857 NOUMEA CEDEX,"Développer une application en lien avec une base de données,Garantir le bon fonctionnement, la disponibilité et la performance d'une solution logicielle,Créer une documentation technique,Assembler des composants logiciels,Tester un logiciel, un système d'informations, une application,Communiquer auprès de ses clients internes et externes,Gérer et déployer des logiciels à distance,Coder,Vérifier la compatibilité des développements produits avec les spécifications,Concevoir une application web,Développer un logiciel, un système d'informations, une application,Analyser, exploiter, structurer des données,Concevoir l'architecture d'un système, d'un réseau,Respecter la confidentialité des informations",,contact@agilesoft.nc
J1502,2026-01-15,Infirmier général / Infirmière générale,2026-01-15 09:20:26+00,Dès que possible,,,1,2026-01-024016,2026-01-15 09:20:26+00,,Au moins 1 an,Païta,RESIDENCE LES PAVILLONS D'EUGENIE,98890 PAITA,"Informer l'entourage lors d'un décès,Concevoir des protocoles de soins,Recueillir les données d'un dispositif médico-technique,Renseigner des supports de suivi d'activité,Informer sur le fonctionnement du service médical/paramédical,Concevoir et mettre en place des protocoles de vigilance sanitaire,Déterminer des mesures correctives,Contrôler les règles de Qualité, Hygiène, Sécurité, Santé et Environnement (QHSSE)",,comptabilite@rpe.nc
N1303,2026-02-01,Superviseur / Superviseuse d'opérations logistiques,2026-01-06 11:05:37+00,"",,,1,2026-01-023922,2026-01-06 11:05:37+00,Bac +2,Au moins 3 ans,Nouméa,NEED EAT,98800 Nouméa,"Superviser des opérations, des actions,Utiliser les outils bureautiques,Appliquer le référentiel qualité de l'entreprise,Respecter les règles de Qualité, Hygiène, Sécurité, Santé et Environnement (QHSSE),Organiser le travail d'une équipe,Contrôler la mise en oeuvre des modes opératoires et règles de fonctionnement en vigueur dans l'entreprise,Rédiger un rapport, un compte rendu d'activité,Organiser le traitement des commandes,Accompagner des équipes au niveau technique et méthodologique,Transmettre de l'information,Utiliser ou renseigner les outils dédiés à la traçabilité de l'activité des équipes logistiques,Informer le client sur les conditions de réalisation d'une commande",,recrutement@needeat.nc
K2107,2026-02-11,Professeur / Professeure de mathématiques,2026-01-05 20:40:33+00,"",LICENCE DES MATHEMATIQUES,1 an(s),1,2025-12-023829,2025-12-19 18:40:19+00,"Bac + 3, bac + 4",Au moins 1 an,Kaala-Gomen,ASSOCIATION CASE,98817 Kaala-gomen,"Organiser des évènements pédagogiques,Organiser des rencontres parents-professeurs,Utiliser les outils bureautiques,Développer un projet pédagogique,Renseigner des supports d'évaluation scolaire,Définir un objectif d'apprentissage et le programme des activités pédagogiques,Surveiller les élèves,Enseigner, transmettre des connaissances, développer des compétences,Concevoir et préparer les cours, les travaux dirigés ou les travaux pratiques,Conseiller des apprenants dans l'organisation de leur travail personnel,Organiser des évaluations de connaissances et de compétences, des examens","Programme de l'Éducation Nationale,Mathématiques",secretariat.baganda@asee.nc
K2107,2026-02-11,Professeur / Professeure de français,2026-01-05 20:43:06+00,"",LICENCE LETTRES MODERNES,1 an(s),1,2025-12-023830,2025-12-19 18:48:04+00,"Bac + 3, bac + 4",Au moins 1 an,Kaala-Gomen,ASSOCIATION CASE,98817 Kaala-gomen,"Organiser des évènements pédagogiques,Organiser des rencontres parents-professeurs,Utiliser les outils bureautiques,Développer un projet pédagogique,Structurer, synthétiser des informations,Renseigner des supports d'évaluation scolaire,Définir un objectif d'apprentissage et le programme des activités pédagogiques,Surveiller les élèves,Enseigner, transmettre des connaissances, développer des compétences,Concevoir et préparer les cours, les travaux dirigés ou les travaux pratiques,Organiser des évaluations de connaissances et de compétences, des examens",Français Langue Étrangère -FLE-,secretariat.baganda@asee.nc
M1805,2026-01-01,Développeur / Développeuse informatique,2026-01-08 22:15:44+00,Dès que possible,BTS ou Diplôme d'ingénieur,,1,2026-01-023960,2026-01-08 22:15:44+00,Bac +2,Au moins 1 an,Nouméa,INFORMAX,98807 NOUMEA CEDEX,"Développer une application en lien avec une base de données,Assembler des composants logiciels,Recueillir et analyser les besoins client,Tester un logiciel, un système d'informations, une application,Réaliser la mise en production de solutions logicielles dans un environnement d'exploitation,Paramétrer un logiciel, un outil, un système numérique,Coder,Développer un logiciel, un système d'informations, une application,Respecter la confidentialité des informations","Algorithmique,Langages de programmation informatique",direction.informax@lagoon.nc
G1801,2025-11-14,Serveur / Serveuse de bar,2025-11-14 13:22:17+00,Dès que possible,,3 mois,2,2025-11-023531,2025-11-14 13:22:17+00,,Au moins 1 an,Nouméa,MV LOUNGE,98800 Nouméa,"Accueillir le client et l'installer,Saisir une commande sur informatique,Réaliser un service en salle,Communiquer à l'oral en milieu professionnel,Changer un fût,Gérer une caisse,Respecter les règles de Qualité, Hygiène, Sécurité, Santé et Environnement (QHSSE),Gérer une situation conflictuelle,Entretenir, nettoyer un espace, un lieu, un local,Utiliser des logiciels spécifiques,Réaliser la mise en place de la salle et de l'office,Prendre une commande client",,recrutement@medusabeachclub.net
D1402,2025-12-26,Commercial / Commerciale auprès d'une clientèle d'entreprises,2025-12-26 07:47:32+00,Dès que possible,,,1,2025-12-023854,2025-12-26 07:46:56+00,Bac +2,Au moins 3 ans,Nouméa,Anonyme,,"Développer et fidéliser la relation client,Établir un plan de tournée de prospection (ciblage, interlocuteurs, préparation de dossiers techniques),Mettre en oeuvre des actions commerciales et promotionnelles,Conseiller, accompagner une personne,Élaborer, adapter une proposition commerciale,Utiliser les outils bureautiques,Négocier des conditions commerciales,Prospecter de nouveaux clients, de nouveaux marchés","Logiciel de gestion clients,Gestion administrative d'une prospection,Prospection commerciale,Méthodes de plan de prospection",cyril.jay@inter-invest.fr
M1810,2026-01-07,Ingénieur / Ingénieure d'exploitation informatique,2026-01-07 09:16:54+00,Dès que possible,Informatique,,1,2026-01-023929,2026-01-07 09:16:54+00,Bac + 5 et plus,Au moins 3 ans,Nouméa,CAFAT,98849 NEA CEDEX,"Gérer une base de données numériques,Diagnostiquer la nature et l'origine des incidents et mettre en oeuvre les mesures correctives,Administrer un système d'informations,Structurer, synthétiser des informations,Communiquer auprès de ses clients internes et externes,Superviser et organiser les travaux d'exploitation/production informatique,Surveiller le fonctionnement d'applicatifs et logiciels","Normes et standards d'exploitation,Analyse d'incidents",recrutement@cafat.nc
H1502,2026-01-07,Responsable Qualité Sécurité Environnement -QSE- en industrie,2026-01-07 13:18:13+00,Dès que possible,,,1,2026-01-023934,2026-01-07 13:18:13+00,Bac + 5 et plus,Au moins 3 ans,Dumbéa,SOCALOG,98839,"Créer une documentation technique,Élaborer des actions ou des règles de prévention,Diriger et gérer un ensemble, une structure, une organisation,Élaborer des règles et procédures de Qualité, Hygiène, Sécurité, Santé et Environnement (QHSSE),Piloter une démarche qualité, un processus d'amélioration continue,Appliquer un cadre juridique ou réglementaire,Réaliser une veille documentaire,Contrôler et faire appliquer le respect de dispositions légales et réglementaires,Sensibiliser un public,Respecter les règles de Qualité, Hygiène, Sécurité, Santé et Environnement (QHSSE),Rédiger un rapport d'audit,Apporter une assistance technique,Animer, coordonner une équipe,Enseigner, transmettre des connaissances, développer des compétences,Contrôler la conformité des données ou des documents","Démarche qualité,Procédure de certification,Progiciels de gestion intégrée d'entreprise (ERP),Normes qualité,Application procédures qualité,Audit qualité,Système de Management de la Qualité (SMQ),Normes environnementales,Analyse statistique,Dispositifs d'agréments et certification",rh@socalog.nc
J1102,2026-01-07,Ophtalmologue,2026-01-07 13:20:16+00,Dès que possible,Diplome d'état Docteur en ophtalmologie,4 mois,1,2026-01-023935,2026-01-07 13:20:16+00,Bac + 5 et plus,Au moins 1 an,Koné,MUTUELLE DU NICKEL,98845 Nouméa cédex,"Renseigner, mettre à jour une documentation technique,Réaliser la prescription médicale, expliquer les modalités de traitement au patient et le conseiller sur l'hygiène de vie,Mettre en oeuvre un projet thérapeutique,Déterminer les besoins thérapeutiques et réaliser les soins médicaux,Pratiquer des expertises médicales,Recenser les symptômes, les dysfonctionnements, cerner l'environnement de vie du patient et procéder à l'examen clinique,Actualiser le dossier médical du patient",,rh@mdn.nc
F1201,2026-01-07,Conducteur / Conductrice de travaux,2026-01-07 18:25:54+00,Dès que possible,,,1,2026-01-023944,2026-01-07 18:25:54+00,Bac +2,Au moins 3 ans,Nouméa,BATICAL,98800,"Développer et piloter un réseau d'organisations partenaires,Contrôler la réalisation et les coûts d¿une prestation,Établir, mettre à jour un dossier, une base de données,Optimiser les effectifs, l'adéquation et l'allocation des ressources,Communiquer auprès de ses clients internes et externes,Identifier et sélectionner des fournisseurs, sous-traitants, prestataires,Réceptionner un ouvrage,Planifier des opérations de chantier,Organiser des réunions et des visites de chantier,Apporter un appui technique aux équipes de chantier,Calculer, analyser et justifier les résultats du chantier,Coordonner des travaux d'aménagement paysager, de végétalisation de toitures et terrasses,Animer, coordonner une équipe,Élaborer, suivre et piloter un budget,Créer une documentation technique,Utiliser les outils bureautiques,Préparer l'intervention et installer le chantier,Concevoir et mettre en oeuvre un plan de développement des compétences,Suivre un contrat, vérifier le respect des clauses contractuelles,Détecter des besoins d'intervention supplémentaire avec le maître d'ouvrage,Superviser les plans d'exécution et de détail à partir d'une maquette numérique 3D,Anticiper la mise en oeuvre des différentes phases de chantier pour veiller au respect du planning global,Estimer le coût de travaux et de chantiers,Présenter un dossier de chantier au chef de chantier et aux intervenants,Travailler en réseau",,rrh@batical.nc
K1302,2026-01-02,Auxiliaire de Vie Sociale -AVS-,2026-01-02 10:17:17+00,Dès que possible,,,3,2026-01-023890,2026-01-02 10:17:17+00,Certification locale,Aucune expérience professionnelle,Païta,Anonyme,,"Accompagner la personne dans les gestes de la vie quotidienne,Réaliser des soins d'hygiène corporelle, de confort et de prévention,Suivre l'état de santé de la personne, relever les modifications de comportement, états dépressifs, ... et informer les interlocuteurs concernés (famille, médecin, ...),Procurer à la personne des éléments de confort (rehaussage/réglage du fauteuil, du lit, ...), de réconfort et vérifier les éléments de sécurité, d'assistance médicale, ...,Réaliser pour la personne des courses, la préparation des repas, des formalités administratives, ...,Conseiller la personne dans ses activités de la vie quotidienne","Règles d'hygiène et de propreté,Diététique,Manipulation d'équipement (lit médicalisé, lève malade, ...),Ergonomie,Techniques d'écoute et de la relation à la personne,Gérontologie,Gestes d'urgence et de secours,Techniques d'écoute active,Règles de sécurité domestique",comptabilite@rpe.nc
G1202,2026-01-07,"Animateur / Animatrice d'activités culturelles, techniques ou ludiques",2026-01-07 15:47:14+00,Dès que possible,,11 mois,1,2026-01-023939,2026-01-07 15:47:14+00,Bac +2,Moins d'1 an,Nouméa,Association Symbiose,98800 NOUMEA,"Organiser, coordonner un événement,Utiliser les outils bureautiques,Organiser et planifier une activité,Utiliser les réseaux sociaux,Actualiser régulièrement ses connaissances,Réaliser le bilan du projet d'animation et proposer des axes d'évolution,Vérifier le fonctionnement des appareils, effectuer la maintenance de premier niveau ou informer le responsable, le service maintenance en cas de dysfonctionnements,Enseigner, transmettre des connaissances, développer des compétences,Accompagner des groupes lors de visites guidées ou sorties ludiques,Animer des activités culturelles et artistiques,Proposer au public le programme des activités socioculturelles","Culture générale / Domaine culturel,Caractéristiques socio-culturelles des publics,Règles de sécurité des biens et des personnes,Organisation d'évènements culturels ou artistiques,Technologies de l'information et de la communication (TIC),Techniques pédagogiques",vcornuet.symbiose@gmail.com
I1305,2026-01-08,Technicien / Technicienne de maintenance en matériel biomédical,2026-01-08 09:22:18+00,Dès que possible,Electronique ou electro-technique,,1,2026-01-023949,2026-01-08 09:22:18+00,Bac +2,Au moins 3 ans,Nouméa,BioMed Pacific,98800,"Installer et entretenir des équipements / systèmes électroniques,Assister un client lors de la prise en main d'un outil/ équipement,Planifier une intervention,Organiser et planifier une activité,Renseigner les supports de suivi d'intervention et transmettre les informations au service concerné,Détecter un dysfonctionnement,Installer un équipement électronique,Diagnostiquer une panne,Définir les interventions sur un équipement selon le dossier technique,Participer à un travail collaboratif,Changer une pièce défectueuse,Contrôler le fonctionnement d'un équipement, d'une machine, d'une installation,Changer ou réparer une pièce ou un ensemble défectueux,Apporter une assistance technique,Configurer l'installation et effectuer sa mise au point,Lire et interpréter des données et documents techniques au besoin en anglais,Monter et régler une installation, une machine,Identifier les composants et les pièces défectueuses,Réaliser un diagnostic technique,Assurer la traçabilité des interventions,Rendre compte de son activité,Établir un devis d'intervention,Évaluer les délais d'une prestation,Évaluer les coûts d'une prestation","Équipements et systèmes médico-chirurgicaux,Électronique,Électrotechnique,Logiciels de Gestion de Maintenance Assistée par Ordinateur (GMAO),Utilisation d'appareils de mesure électrique (multimètre, ...),Lecture de plan, de schéma,Electricité,Informatique,Chiffrage/calcul de coût",contact@biomed.nc
D1407,2026-01-08,Technico-commercial / Technico-commerciale,2026-01-08 09:22:56+00,Dès que possible,"Électrotechnique , Électronique ou métier de la santé.",,1,2026-01-023950,2026-01-08 09:22:56+00,"Bac + 3, bac + 4",Au moins 3 ans,Nouméa,BioMed Pacific,98800,"Intervenir auprès d'une clientèle d'entreprises,Intervenir auprès d'une clientèle de collectivités / administration,Mener une action commerciale,Mettre en place des actions de formation,Concevoir une étude de faisabilité technique,Définir le plan d'action commercial et établir le plan de tournée (ciblage, interlocuteurs, préparation de dossiers techniques),Négocier un contrat,Suivre la réalisation d'une prestation technique,Établir un contrat de vente,Déterminer des mesures correctives,Établir un devis","Langue étrangère - Anglais des affaires,Logiciel de gestion clients,Typologie du client,Outils bureautiques,Techniques commerciales,Droit commercial",contact@biomed.nc
I1604,2026-01-12,Réceptionnaire en atelier mécanique automobile,2026-01-12 10:49:14+00,Dès que possible,commerce,,1,2026-01-023973,2026-01-12 10:49:14+00,"Bac, bac professionnel",Au moins 3 ans,Nouméa,SODAUTO,98848 NOUMEA CEDEX,"Planifier les réceptions de véhicules,Développer et fidéliser la relation client,Déterminer une solution technique de remise en état du véhicule et des équipements,Élaborer, adapter une proposition commerciale,Conduire un véhicule léger,Estimer les coûts et les délais d'une activité ou d'une prestation,Réaliser un essai sur route d'un véhicule automobile particulier ou industriel,Acceuillir, orienter, informer une personne","Spécificités d'un moteur essence,Spécificités d'un moteur électrique,Véhicules légers,Spécificités d'un moteur à biocarburant (diester, ...),Intervention de service rapide,Principes de fonctionnement d'un moteur,Chiffrage/calcul de coût",n.gregoire@hgj.nc
I1307,2026-01-12,Technicien / Technicienne sécurité-alarme,2026-01-12 08:52:31+00,Dès que possible,Electrotechnique ou électronique,,1,2026-01-023969,2026-01-12 08:52:31+00,"Bac, bac professionnel",Aucune expérience professionnelle,Nouméa,SECU SYSTEM'S,98845 NEA CEDEX,"Assembler des matériaux, des produits,Élaborer, adapter une proposition commerciale,Remettre les systèmes en état de fonctionnement par échange standard ou réfection d'ensemble ou de sous-ensemble,Configurer ou paramétrer l'équipement de télécommunication, de courants faibles et effectuer les essais fonctionnels,Renseigner les supports de suivi d'intervention et transmettre les informations au service concerné,Installer l'équipement sur le site et le connecter aux réseaux extérieurs,Vérifier la conformité de l'installation sur site, help desk, hot line,Entretenir du matériel multimédia,Estimer les coûts et les délais d'une activité ou d'une prestation,Réaliser une intervention nécessitant une habilitation,Réceptionner et décharger les matériaux livrés en s'assurant de la conformité de la livraison en quantité et en qualité,Connecter une boîte de raccordements,Analyser un cahier des charges,Changer ou réparer une pièce ou un ensemble défectueux,Apporter une assistance technique,Assembler les éléments de l'équipement,Préparer du matériel en prévision d'un travail,Actualiser et faire évoluer les équipements de télécommunication ou de courants faibles,Identifier les matériels à intégrer,Identifier les phases d'intervention à partir des informations du diagnostic help desk, de la hot line, des dossiers constructeur","Micro-informatique,Organisation d'une baie de brassage,Traitement du son,Caractéristiques des Modulateurs Démodulateurs -MODEM-,Technologie des fibres optiques,Installations surveillance-intrusion,Systèmes de sécurité-incendie,Technologies radiofréquences,Installation de téléphonie,Lecture de plan, de schéma,Electricité,Électronique,Protocoles IP,Utilisation d'analyseur de protocole de réseaux WireShare,Protocoles et normes télécoms,Utilisation d'appareils de mesure optique (réflectomètre, wattmètre optique, ...),Utilisation d'appareils de mesure électrique (multimètre, ...),Utilisation de soudeuse à fibres optiques,Architecture d'un réseau téléphonique commuté,Informatique",secusystems@secusystem.nc
M1802,2026-01-15,Ingénieur / Ingénieure système réseau informatique,2026-01-15 10:19:59+00,Dès que possible,,,1,2026-01-024021,2026-01-15 10:19:59+00,,Au moins 1 an,Nouméa,DEVEO.NC,98800 Nouméa,"Procéder aux phases de tests et de recettes des applications développées,Concevoir l'architecture d'un système d'information,Analyser les besoins d'un projet,Mettre en place les procédures techniques d'exploitation, d'utilisation et de sécurité des équipements informatiques,Définir les caractéristiques techniques du produit,Analyser les besoins du client,Mener ou accompagner un projet d'intégration (implémentation) ou de développement de solutions matérielles, logicielles","Principes d'intégration de matériels et de logiciels,Règles de sécurité Informatique et Télécoms,Méthodes d'analyse (systémique, fonctionnelle, de risques, ...),Normes et standards d'exploitation,Systèmes d'exploitation informatique,Réseaux informatiques et télécoms",contact@deveo.nc
M1707,2026-03-02,Responsable développement / Business Developer,2026-01-12 09:57:51+00,"",marketing commercial communication,12 mois,1,2026-01-023970,2026-01-12 09:57:51+00,Bac + 5 et plus,Au moins 3 ans,Nouméa,CCI-NC,98849 Nouméa Cédex,"Concevoir et gérer un projet,Élaborer, suivre et piloter un budget,Développer et fidéliser la relation client,Concevoir des supports de suivi et de gestion,Piloter une activité,Préparer et animer une réunion, un groupe de travail, un atelier,Mettre en oeuvre une stratégie commerciale,Rechercher et identifier des évolutions de marchés, des marchés potentiels,Déterminer le potentiel d'un client ou prospect,Prospecter de nouveaux clients, de nouveaux marchés,Rédiger un cahier des charges, des spécifications techniques,Réaliser une veille de marché, une veille concurrentielle,Développer un portefeuille clients et prospects","Outils de planification,Techniques commerciales,Analyse statistique",
H1303,2026-01-12,Animateur / Animatrice en sécurité du travail,2026-01-12 14:02:19+00,Dès que possible,HSE,,1,2026-01-023978,2026-01-12 14:02:19+00,Bac +2,Au moins 1 an,Nouméa,CAFAT,98849 NEA CEDEX,"Analyser un dysfonctionnement ou une non-conformité,Formuler des propositions d'amélioration des process, des conditions de travail et de la santé et sécurité au travail,Structurer, synthétiser des informations,Analyser et prévenir les risques,Définir des mesures de prévention des risques,Prévenir les risques environnementaux,Réaliser des relevés, mesures, prélèvements, identifier des écarts (taux, seuil, ...) et préconiser des mesures correctives","Sécurité du travail,Démarche qualité,Démarche Hygiène, Sécurité et Environnement (HSE),Métrologie,Ergonomie,Normes environnementales,Hygiène industrielle,Plan de Prévention des Risques (PPR),Techniques pédagogiques",recrutement@cafat.nc
M1203,2026-01-09,Gestionnaire paie,2026-01-09 18:00:53+00,Dès que possible,,,1,2026-01-023965,2026-01-09 18:00:53+00,Bac +2,Au moins 3 ans,Nouméa,Anonyme,,"Optimiser un processus de paie,Établir, mettre à jour un dossier, une base de données,Utiliser les outils bureautiques,Gérer la paie,Établir des déclarations fiscales et sociales,Assurer la gestion administrative d'une activité,Établir un contrat de travail,Établir un bulletin de paie,Préparer les éléments constitutifs de la paie",,contact@fidecsocial.nc
M1203,2026-01-12,Aide-comptable,2026-01-12 15:31:19+00,Dès que possible,,1 mois,1,2026-01-023979,2026-01-12 14:02:33+00,"Bac, bac professionnel",Au moins 1 an,Nouméa,Anonyme,,"Enregistrer les recettes d'une entreprise,Établir, mettre à jour un dossier, une base de données,Utiliser les outils bureautiques,Réaliser des opérations comptables,Contrôler la conformité des données ou des documents,Contrôler les recettes d'une entreprise","Comptabilité fournisseurs,Comptabilité client,Comptabilité générale,Logiciels comptables",recrutmdpmdr@gmail.com
F1105,2026-01-12,Géologue,2026-01-12 17:05:17+00,Dès que possible,,,1,2026-01-023985,2026-01-12 17:05:17+00,Bac + 5 et plus,Au moins 10 ans,Nouméa,SMT,98852 NOUMEA CEDEX,"Concevoir et gérer un projet,Contrôler la qualité et la conformité des process,Diriger et gérer un ensemble, une structure, une organisation,Utiliser les outils bureautiques,Réaliser une veille documentaire,Organiser et planifier une activité,Structurer, synthétiser des informations,Concevoir des modèles géologiques théoriques, prédictifs de sols, sous-sols (calcul, simulation, modélisation),Réaliser des relevés de sondage, forage, pollution des sols et sous-sols,Définir des mesures de prévention des risques,Établir des résultats d'analyses et de mesures,Interpréter les relevés géologiques de sols, sous-sols, roches et étudier les caractéristiques (étendues, compositions, géométrie, ...),Animer, coordonner une équipe,Collecter et analyser des informations",,recrutement@smt.nc
