coderome,a_pourvoir_le,titre_offre,date_publication,des_que_possible_desc,diplome,duree_contrat,nb_postes,numero,created,niveau_formation,experience,commune_emploi,employeur_nom_entreprise,employeur_adresse_correspondance_subdivision,activites_multivalue,competences_multivalue,contact_mail
G1602,2026-01-12,Second / Seconde de cuisine,2026-01-12 10:14:48+00,Dès que possible,Cuisine,1 mois,1,2026-01-023971,2026-01-12 10:14:48+00,"CAP, BEP",Au moins 3 ans,Nouméa,Anonyme,,"Préparer les viandes et les poissons (brider, barder, vider, trancher, ...),Superviser la préparation des produits culinaires,Entretenir des équipements,Conditionner un produit,Entretenir un poste de travail,Cuisiner des sauces,Définir des besoins en approvisionnement,Entretenir, nettoyer un espace, un lieu, un local,Entretenir un équipement, une machine, une installation,Éplucher des légumes et des fruits,Entretenir un outil ou matériel,Réceptionner des produits, des matières premières, vérifier la conformité d'une livraison,Mettre en oeuvre les processus et les modes opératoires techniques,Expliquer et faire respecter les règles et procédures,Contrôler l'état des stocks,Doser des ingrédients culinaires,Mettre en marche des équipements de cuisine,Préparer un plan de travail,Préparer des ustensiles de cuisine,Préparer des plats cuisinés,Cuire des viandes, poissons ou légumes,Mélanger des produits et ingrédients culinaires,Relever, contrôler, ajuster des mesures et dosages,Manipuler des équipements de cuisine,Dresser des plats pour le service,Préparer des desserts","Procédures de nettoyage et de désinfection,Types de viande,Règles et consignes de sécurité,Types de desserts,Système Hazard Analysis Critical Control Point (HACCP),Chaîne du froid,Conditionnement des aliments,Cellule de refroidissement,Production culinaire,Familles de produits alimentaires,Utilisation de plaques de cuisson,Modes de cuisson des aliments,Utilisation d'outils tranchants (couteaux, hachoirs, ...),Utilisation de four (à chaleur tournante, à air pulsé, ...),Variétés de fruits et légumes,Modes de conservation des produits alimentaires,Règles d'hygiène et de sécurité alimentaire",gestionpersonnel@cuenet.nc
I1305,2026-01-12,Technicien / Technicienne de maintenance en microtechnique électronique,2026-01-12 12:05:14+00,Dès que possible,,1 mois,1,2026-01-023975,2026-01-12 12:05:14+00,Bac +2,Au moins 3 ans,Nouméa,EDS SARL,98800 DUCOS,"Assister un utilisateur à distance,Installer et entretenir des équipements / systèmes électroniques,Définir les caractéristiques techniques du produit,Assister un client lors de la prise en main d'un outil/ équipement,Planifier une intervention,Sélectionner des machines et des outillages appropriés,Changer une pièce défectueuse,Contrôler le fonctionnement d'un équipement, d'une machine, d'une installation,Apporter une assistance technique,Configurer l'installation et effectuer sa mise au point,Détecter un dysfonctionnement,Installer un équipement électronique,Définir l'intervention et sélectionner les machines et outillages appropriés,Diagnostiquer une panne,Connecter des équipements électroniques,Identifier les composants et les pièces défectueuses,Adapter un équipement électronique à de nouveaux besoins","Régulation et instrumentation,Commande numérique,Appareils électroniques de navigation,Règles de sécurité,Technologie des fibres optiques,Electricité,Électronique,Électrotechnique,Logiciels de Gestion de Maintenance Assistée par Ordinateur (GMAO),Utilisation d'appareils de mesure électrique (multimètre, ...),Langages de programmation informatique,Habilitations électriques de travaux sous tension",direction.eds.nc@gmail.com
D1402,2026-01-12,Commercial / Commerciale en biens de consommation auprès des entreprises,2026-01-12 17:30:22+00,Dès que possible,,,1,2026-01-023986,2026-01-12 17:30:22+00,,Au moins 5 ans,Nouméa,OPTIMIUM.SYSTEMS,98802 NOUMEA CEDEX,"Développer et fidéliser la relation client,Mettre en oeuvre des actions commerciales et promotionnelles,Élaborer, adapter une proposition commerciale,Utiliser les outils bureautiques,Effectuer le suivi des commandes, la facturation,Définir les modalités d'une vente avec un client,Définir le plan d'action commercial et établir le plan de tournée (ciblage, interlocuteurs, préparation de dossiers techniques),Conseiller une clientèle ou un public,Élaborer des propositions commerciales,Négocier des conditions commerciales,Effectuer une démonstration devant un client ou un public,Prospecter de nouveaux clients, de nouveaux marchés,Mener une action commerciale","Logiciel de gestion clients,Prospection commerciale,Techniques de communication,Outils bureautiques,Techniques commerciales,Méthodes de plan de prospection,Droit commercial",c.tourdot@optimium.nc
D1212,2026-01-12,Vendeur / Vendeuse en accessoires automobile,2026-01-12 10:27:02+00,Dès que possible,,,1,2026-01-023972,2026-01-12 10:27:02+00,"Bac, bac professionnel",Au moins 3 ans,Nouméa,SUPERCAL EQUIPEMENT,98845 NOUMEA CEDEX,"Informer, renseigner une personne sur les articles en vente,Assurer un service après-vente,Vendre ou louer des produits ou des services,Gérer une caisse,Procéder à l'encaissement,Définir des besoins en approvisionnement,Assurer la gestion administrative d'une activité,Contrôler l'état des stocks,Présenter et valoriser un produit ou un service,Acceuillir, orienter, informer une personne","Argumentation commerciale,Techniques de vente,Accessoires automobiles",n.gregoire@hgj.nc
E1306,2026-01-09,Graphiste en Publication Assistée par Ordinateur -PAO-,2026-01-12 16:37:46+00,Dès que possible,Bachelor concepteur designer UI,3 mois,1,2026-01-023964,2026-01-09 16:30:32+00,"Bac + 3, bac + 4",Au moins 1 an,Nouméa,SOLAR COMM',98835 Dumbéa,"Concevoir et réaliser des éléments graphiques et visuels,Réaliser une épreuve de contrôle,Corriger et mettre en forme un document,Saisir le texte ou réaliser la maquette à partir du manuscrit, pré-projet, brouillon,Traiter textes et images en fonction des modes et des supports d'impression,Sélectionner des documents et images dans une base documentaire,Concevoir une signalétique,Préparer des documents pour une impression,Animer, coordonner une équipe,Assurer la gestion de base de logiciels ou matériels numériques,Contrôler un système d'imposition numérique,Rédiger un cahier des charges, des spécifications techniques,Réaliser la reproduction de maquettes à partir d'un moniteur vidéo ou d'un vidéoprojecteur","Utilisation de machine de découpage automatique,Techniques de séparation Cyan Magenta Jaune Noir,Utilisation de machines à commandes numériques,Typographie,Publication Assistée par Ordinateur (PAO),Chaîne graphique,Sérigraphie,Communication visuelle,Colorimétrie",solarcommnc@gmail.com
D1401,2026-03-02,Assistant commercial / Assistante commerciale,2026-01-12 16:38:04+00,"",,6 mois,1,2026-01-023947,2026-01-08 08:20:46+00,Bac +2,Au moins 3 ans,Nouméa,IMDEX,98846 NOUMEA CEDEX,"Assurer un service après-vente,Développer et fidéliser la relation client,Établir, mettre à jour un dossier, une base de données,Mettre en oeuvre des actions commerciales et promotionnelles,Utiliser les outils bureautiques,Effectuer le suivi des commandes, la facturation,Assurer un accueil téléphonique,Vérifier les conditions de réalisation d'une commande,Établir un devis,Assurer la gestion administrative d'une activité,Transmettre de l'information,Déterminer des mesures correctives,Acceuillir, orienter, informer une personne,Développer un portefeuille clients et prospects","Logiciel de gestion clients,Prospection commerciale,Techniques de vente,Logistique internationale,Bon de livraison,Organisation de la chaîne logistique,Techniques commerciales,Techniques d'import/export",direction@imdex.nc
N1103,2026-01-13,Magasinier / Magasinière cariste,2026-01-13 07:58:18+00,Dès que possible,Logistique,3 mois,1,2026-01-023989,2026-01-13 07:58:18+00,"Bac, bac professionnel",Au moins 1 an,La Foa,MEARE QUINCAILLERIE,98845 NOUMEA CEDEX,"Réaliser le prélèvement de produits selon les instructions de préparation de commande et constituer les colis, lots, ...,Réaliser un inventaire,Respecter les règles de Qualité, Hygiène, Sécurité, Santé et Environnement (QHSSE),Ranger du matériel,Gérer les stocks,Contrôler l'état des stocks,Organiser le traitement des commandes,Manipuler un engin de manutention ou de chantier,Charger, décharger, manutentionner des produits,Réceptionner des produits, des matières premières, vérifier la conformité d'une livraison","Modalités de stockage,Règles et consignes de sécurité,Modalités de chargement/déchargement de marchandises,Utilisation d'engins de manutention non motorisés (transpalette, diable, ...),Chariots frontaux en porte-à-faux (capacité nominale < ou = à 6 tonnes) (CACES R 489-3) - Depuis le 01/01/2020,Gestes et postures de manutention,Logiciel de gestion de stocks",recrutementennc@gmail.com
M1801,2026-01-13,Administrateur / Administratrice système et réseaux d'information et de communication,2026-01-13 08:19:50+00,Dès que possible,,2 mois,1,2026-01-023991,2026-01-13 08:19:50+00,Bac +2,Au moins 5 ans,Nouméa,ALCYONE,98845 NOUMEA CEDEX,"Accompagner l'appropriation d'un outil par ses utilisateurs,Administrer un système d'informations,Évaluer, prévenir, et gérer les risques et la sécurité,Structurer, synthétiser des informations,Déterminer les causes de dysfonctionnements,Gérer la sécurité informatique,Réaliser les interventions de télémaintenance,Sélectionner les équipements informatiques,Améliorer un système d'information,Réaliser une veille technique ou technologique pour anticiper les évolutions,Gérer les droits d'accès des utilisateurs,Installer un équipement informatique,Attribuer des ressources logistiques et matérielles de réseaux,Utiliser une installation, une machine","Système d'exploitation Windows,Système de messagerie,Système d'exploitation AS 400,Paramétrage de logiciels,Normes qualité,Système d'exploitation Linux,Système réseau (LAN, MAN, WAN),Règlement Général européen sur la Protection des Données (RGPD),Règles d'installation informatiques,Protection des données numériques",lrouvoune@alcyone.nc
H1503,2026-01-13,Technicien / Technicienne chimiste en laboratoire d'analyse industrielle,2026-01-13 14:24:35+00,Dès que possible,DUT OU BACHELOR CHIMIE,,1,2026-01-023996,2026-01-13 14:24:35+00,Bac +2,Au moins 3 ans,Nouméa,STE LE NICKEL - SLN,98800 NOUMEA,"Accompagner l'appropriation d'un outil par ses utilisateurs,Structurer, synthétiser des informations,Concevoir des protocoles d'analyses,Analyser des échantillons solides, liquides, gazeux (eau, boues, déchets) et consigner les résultats,Contrôler la conformité d'un résultat d'analyse,Définir des besoins en approvisionnement,Organiser et contrôler un approvisionnement,Entretenir un équipement, une machine, une installation,Analyser, exploiter, structurer des données,Contrôler les règles de Qualité, Hygiène, Sécurité, Santé et Environnement (QHSSE),Préparer les produits et les appareils de mesures et d'analyses et contrôler leur conformité d'étalonnage et de fonctionnement,Identifier les causes liées à l'origine des cas de non-conformité relevées,Renseigner, mettre à jour une documentation technique,Analyser la qualité et la conformité des matières premières,Comprendre, interpréter des données et documents techniques,Réaliser la maintenance de premier niveau,Respecter les règles de Qualité, Hygiène, Sécurité, Santé et Environnement (QHSSE),Rédiger un rapport, un compte rendu d'activité,Utiliser des logiciels spécifiques,Participer à un travail collaboratif,Réceptionner les échantillons, ou effectuer des prélèvements sur les chantiers ou les sites de production, en respectant strictement les modes opératoires et les protocoles,Respecter des procédures, modes opératoires et instructions,Collecter, tester, analyser des échantillons, des matériaux,Évacuer, recycler des déchets, des produits,Relever, contrôler, ajuster des mesures et dosages","Régulation et instrumentation,Analyse physico-chimique environnementale,Normes qualité,Bonnes Pratiques de Laboratoire -BPL-,Logiciels de gestion de base de données,Logiciel de gestion documentaire,Équipements de laboratoire",ingrid.kaddour@eramet-sln.com
M1805,2026-01-13,Développeur / Développeuse d'application,2026-01-13 14:37:15+00,Dès que possible,BTS ou DEUST INFORMATIQUE,,1,2026-01-023998,2026-01-13 14:37:15+00,Bac +2,Au moins 3 ans,Nouméa,STE LE NICKEL - SLN,98800 NOUMEA,"Développer une application en lien avec une base de données,Créer une documentation technique,Concevoir et développer une solution digitale,Recueillir et analyser les besoins client,Tester un logiciel, un système d'informations, une application,Communiquer auprès de ses clients internes et externes,Proposer des pistes d'amélioration des solutions,Coder,Réaliser des études et développements informatiques,Gérer une situation d'urgence,Paramétrer un logiciel, un outil, un système numérique,Analyser, exploiter, structurer des données,Rédiger un cahier des charges, des spécifications techniques,Concevoir une application web,Développer un logiciel, un système d'informations, une application,Surveiller le fonctionnement d'applicatifs et logiciels,Intégrer des outils IA/Data Science","Java,SQL,Application web,ASP.NET,Informatique de gestion,Anglais technique,Informatique industrielle",ingrid.kaddour@eramet-sln.com
K1403,2026-01-13,Responsable de secteur d'aide à domicile,2026-01-13 17:51:42+00,Dès que possible,Domaine social,,1,2026-01-024002,2026-01-13 17:51:42+00,Bac +2,Au moins 3 ans,Nouméa,AGE D'OR NC,98846 NOUMEA CEDEX,"Superviser des opérations, des actions,Faciliter et créer les conditions de la coopération,Utiliser les outils bureautiques,Utiliser les outils collaboratifs,Expliquer et faire respecter les règles et procédures,Contrôler et faire appliquer le respect de dispositions légales et réglementaires,Évaluer, prévenir, et gérer les risques et la sécurité,Préparer et animer une réunion, un groupe de travail, un atelier,Analyser la qualité d'un service,Respecter les règles d'éthique et de déontologie,Organiser l'activité de production des personnes prises en charge,Prévenir les risques psychosociaux,Apporter un appui technique pour le personnel,Coordonner des soins médicaux,Animer, coordonner une équipe,Développer et piloter un réseau d'organisations partenaires,Développer et gérer des relations interpersonnelles,Prévenir et résoudre les conflits,Coordonner l'intervention d'équipes pluridisciplinaires","Techniques d'animation de groupe,Diagnostic social,Caractéristiques socio-culturelles des publics,Prévention des risques médicaux,Droits et obligations des usagers,Législation sociale,Techniques de communication orales, écrites et numériques,Méthode d'analyse de besoins (poste, formation, projet, /...),Organisation du système sanitaire et social",rh@agedornc.nc
F1201,2026-03-01,Conducteur / Conductrice de travaux,2026-01-14 10:55:44+00,"",,,1,2026-01-024007,2026-01-14 10:55:44+00,Bac + 5 et plus,Au moins 5 ans,Dumbéa,Anonyme,,"Contrôler la qualité et la conformité des process,Contrôler la réalisation et les coûts d¿une prestation,Établir, mettre à jour un dossier, une base de données,Optimiser les effectifs, l'adéquation et l'allocation des ressources,Communiquer auprès de ses clients internes et externes,Identifier et sélectionner des fournisseurs, sous-traitants, prestataires,Réceptionner un ouvrage,Planifier des opérations de chantier,Organiser des réunions et des visites de chantier,Apporter un appui technique aux équipes de chantier,Superviser la gestion des stocks,Gérer les ressources humaines,Animer, coordonner une équipe,Créer une documentation technique,Utiliser les outils bureautiques,Préparer l'intervention et installer le chantier,Effectuer le suivi des commandes, la facturation,Suivre un contrat, vérifier le respect des clauses contractuelles,Détecter des besoins d'intervention supplémentaire avec le maître d'ouvrage,Commander les matériaux et matériels,Établir un rapport de chantier,Anticiper la mise en oeuvre des différentes phases de chantier pour veiller au respect du planning global,Présenter un dossier de chantier au chef de chantier et aux intervenants,Implanter des éléments de sécurité ou de signalisation,Travailler en réseau,Développer et piloter un réseau d'organisations partenaires","Règles et consignes de sécurité,Normes de la construction,Techniques de métré,Chiffrage/calcul de coût",recrutement.a16@gmail.com
K1903,2026-01-14,Juriste,2026-01-15 08:19:49+00,Dès que possible,master 2,,1,2026-01-024014,2026-01-15 08:19:49+00,Bac + 5 et plus,Au moins 1 an,Nouméa,ACTECIL-NC,98846 Nouméa Cédex,"Sensibiliser un public à une réglementation,Appliquer un cadre juridique ou réglementaire,Réaliser une veille documentaire,Faire du conseil juridique,Veiller au respect de la loi Informatique et Libertés et du RGPD dans l'entreprise, gérer la liste des traitements de données à caractère personnel, faire l'interface avec la Commission Nationale de l'Informatique et des Libertés - CNIL,Enseigner, transmettre des connaissances, développer des compétences,Rédiger un acte juridique ou règlementaire","Documentation du Délégué à la protection des données,Procédure pénale,Règlement Général européen sur la Protection des Données (RGPD),Protection des données numériques,Règles de sécurité Informatique et Télécoms",contact@actecil-pacifique.nc
M1205,2026-01-15,Directeur administratif et financier / Directrice administrative et financière -DAF-,2026-01-15 09:40:58+00,Dès que possible,Comptabilité,,1,2026-01-024018,2026-01-15 09:40:58+00,Bac + 5 et plus,Au moins 3 ans,Nouméa,NEWREST,98802 NOUMEA CEDEX,"Déployer, intégrer un logiciel, un système d'informations, une application,Élaborer, suivre et piloter un budget,Conseiller une organisation, une structure,Réaliser un audit financier,Piloter une activité,Gérer la relation avec les fournisseurs, sous-traitants, prestataires,Gérer la trésorerie, le recouvrement,Superviser les procédures de gestion financière,Définir la stratégie financière d'une structure,Mettre en oeuvre un contrôle de gestion, un audit interne,Réaliser des opérations comptables,Traiter des dossiers de contentieux,Réaliser des actions de négociation avec des financeurs,Présenter un budget,Assurer la gestion administrative d'une activité,Coordonner et superviser la gestion du patrimoine mobilier et immobilier","Fiscalité,Comptabilité générale,Droit des sociétés,Audit comptable et financier",recrutement.nc@newrest.eu
K1601,2026-01-16,Gestionnaire de bases de données et de ressources documentaires,2026-01-16 09:13:34+00,Dès que possible,,6 mois,1,2026-01-024027,2026-01-16 09:13:34+00,Bac +2,Au moins 3 ans,Nouméa,Easy Skill,98800 NOUMEA,"Créer une documentation technique,Organiser le partage et la capitalisation de l'information,Établir, mettre à jour un dossier, une base de données,Gérer une base documentaire,Utiliser les outils bureautiques,Utiliser les outils collaboratifs,Structurer, synthétiser des informations,Reproduire des documents sous la forme de microfilms, données numériques,Traiter des archives,Sélectionner des informations documentaires,Actualiser des documents et fonds documentaires,Collecter et analyser des informations,Créer des documents numériques,Actualiser des données d'activité","Méthode de classement et d'archivage,Logiciel de gestion documentaire,Normes rédactionnelles,Techniques de numérisation",remy.devedeux@easy-skill.com
D1205,2026-02-01,Employé / Employée de pressing,2026-01-15 09:41:04+00,"",,6 mois,1,2026-01-024019,2026-01-15 09:41:04+00,"Bac, bac professionnel",Au moins 1 an,Nouméa,PASSE ET REPASSE EXPRESS,98800 Nouméa,"Appliquer un traitement, un produit,Développer et fidéliser la relation client,Mettre en oeuvre les systèmes de contrôle qualité,Traiter les demandes et réclamations des clients selon la procédure établie et en proposant des solutions adaptées,Restituer les articles au client après contrôle du nettoyage, repassage,Établir un devis,Charger le linge dans les machines et enclencher le programme,Appliquer le référentiel qualité de l'entreprise,Conduire une relation avec le client insatisfait,Offrir une solution différenciée, adaptée aux besoins client,Définir les indicateurs et leur mode de suivi,Réaliser des opérations de rempliage (ourlet, couture surpiquée...) sur des articles textiles,Réaliser la pose de fermeture à glissière,Identifier, traiter une demande client,Contrôler les règles de Qualité, Hygiène, Sécurité, Santé et Environnement (QHSSE),Trier les articles et déterminer les modes de nettoyage (à l'eau, à sec, avec détachage, ...),Utiliser les outils bureautiques,Contrôler l'application des procédures qualités,Contrôler un approvisionnement,Appliquer les règles et protocoles visant à limiter les effets de l'activité sur l'environnement,Détacher des tissus et peaux,Assurer l'entretien/nettoyage courant du matériel après utilisation dans les conditions d'hygiène et de sécurité requises,Effectuer le retrait et la livraison d'articles chez les clients,Rendre compte de son action, de risques ou d'anomalies au responsable,Pratiquer des gestes et postures de manutention en toute sécurité,Préparer un article en vue du repassage,Interpréter les pictogrammes de sécurité sur les produits et les matériels et déduire les précautions d'usage associées,Réaliser des montages délicats,Retirer des produits non conformes,Identifier une tache ou une salissure,Vérifier la qualité de produits textiles (dimensions, aspect, coutures, etc.),Déclencher un ordre de facturation,Distinguer les matières premières textiles et leurs propriétés,Contrôler l'état de propreté du linge,Assurer les affichages réglementaires,Effectuer les relevés de contrôle sur les fiches de travail,Assurer la gestion administrative d'une activité,Repasser du textile (vêtements, linge),Évacuer, recycler des déchets, des produits,Identifier une clientèle cible ou des prospects","Argumentation commerciale,Nomenclature de la maroquinerie,Manipulation de produits chimiques,Procédures de nettoyage et de désinfection,Techniques de repassage,Caractéristiques des produits d'entretien textiles,Techniques de détachage,Préparation d'apprêt,Utilisation de tampon,Réglementation des pressings,Caractéristiques des produits de nettoyage,Utilisation de console vapeur,Gestes et postures de manutention,Codes et symboles,Caractéristiques des cuirs et peaux,Procédures de retraitement des déchets",passe.repasse.express@gmail.com
F1105,2026-01-07,Géotechnicien / Géotechnicienne,2026-01-07 16:11:27+00,Dès que possible,,6 mois,1,2026-01-023940,2026-01-07 16:11:27+00,Bac + 5 et plus,Au moins 10 ans,Païta,Anonyme,,"Analyser une situation et produire un diagnostic,Réaliser une veille documentaire,Définir et coordonner la mise en oeuvre de méthodes et procédés de recherche, prospections, études de sols, sous-sols,Organiser et planifier une activité,Structurer, synthétiser des informations,Suivre et mettre à jour l'information technique, économique, réglementaire, ...,Évaluer la vulnérabilité d'un ouvrage,Réaliser des études de fondations, de tassement ou de stabilité de terrains (glissement, érosion, résistance),Apporter une assistance technique,Animer, coordonner une équipe,Concevoir et gérer un projet,Créer une documentation technique,Diriger et gérer un ensemble, une structure, une organisation,Extraire, exploiter un forage,Créer un dessin technique, un plan, ou une carte,Prospecter en vue d'opérations d'extraction et de forage,Utiliser les outils bureautiques,Déterminer la densité du sous-sol rocheux,Concevoir des modèles géologiques théoriques, prédictifs de sols, sous-sols (calcul, simulation, modélisation),Réaliser des relevés de sondage, forage, pollution des sols et sous-sols,Définir des mesures de prévention des risques,Identifier, repérer un lieu,Établir des résultats d'analyses et de mesures,Assurer la gestion administrative d'une activité,Interpréter les relevés géologiques de sols, sous-sols, roches et étudier les caractéristiques (étendues, compositions, géométrie, ...),Collecter et analyser des informations,Collecter, tester, analyser des échantillons, des matériaux",,patrick.ganteille@a2ep-geotec.nc
C1109,2026-01-15,Gestionnaire liquidation retraite,2026-01-15 09:09:49+00,Dès que possible,,11 mois,1,2026-01-024015,2026-01-15 09:09:49+00,Bac +2,Au moins 3 ans,Nouméa,Groupe Malakoff Humanis,98845 NOUMEA CEDEX,"Enregistrer et traiter les réclamations des clients et bénéficiaires,Établir, mettre à jour un dossier, une base de données,Conseiller, accompagner une personne,Collecter les informations sur la situation d'un bénéficiaire,Utiliser les outils bureautiques,Gérer l'accueil téléphonique,Contrôler la conformité des données ou des documents,Identifier, traiter une demande client,Faire preuve de pédagogie pour faciliter la compréhension","Suivi et liquidation de prestations maladie, retraite ou invalidité,Législation sociale",delegation.nc@malakoffhumanis.com
